Job Title,Known Skills,Platform,Course Title
Frontend Developer,"tensorflow, react, django, node.js",LinkedIn Learning,React Advanced Concepts
Machine Learning Engineer,"swift, docker, css",LinkedIn Learning,C++ Data Structures and Algorithms
Frontend Developer,"nlp, pandas, c++, deep learning",Coursera,Flask for Web Applications
Frontend Developer,"flask, html, python",Pluralsight,MongoDB for Beginners
Backend Developer,"python, swift, machine learning, deep learning",Pluralsight,Node.js Backend Development
AI Engineer,"aws, kubernetes",edX,Deep Learning Specialization
Backend Developer,"c++, mongodb, flutter",Coursera,SQL for Data Analysis
DevOps Engineer,"flask, python, sql, mongodb",Coursera,SQL for Data Analysis
Machine Learning Engineer,"flutter, css, react, c++",Udemy,Docker Essentials
Machine Learning Engineer,"javascript, nlp",edX,HTML5 and CSS3 Fundamentals
Full Stack Developer,"html, swift, nlp",edX,TensorFlow Deep Learning
Machine Learning Engineer,"flutter, machine learning, sql, react, javascript",LinkedIn Learning,Flutter App Development
Mobile App Developer,"javascript, c++, python, nlp",Coursera,Machine Learning with Python
Mobile App Developer,"docker, java, css, deep learning, aws",Coursera,Java Programming Masterclass
Data Scientist,"sql, kubernetes, flask",Pluralsight,Docker Essentials
Mobile App Developer,"aws, tensorflow",Pluralsight,Java Programming Masterclass
Mobile App Developer,"deep learning, flutter, python, tensorflow",LinkedIn Learning,Deep Learning Specialization
AI Engineer,"swift, javascript",Pluralsight,HTML5 and CSS3 Fundamentals
Machine Learning Engineer,"aws, kubernetes",Pluralsight,Swift Programming for iOS
Backend Developer,"node.js, mongodb",LinkedIn Learning,Flutter App Development
Data Scientist,"c++, python, kubernetes, mongodb",edX,AWS Certified Solutions Architect
AI Engineer,"swift, mongodb, css, html, c++",Udemy,Machine Learning with Python
Machine Learning Engineer,"tensorflow, deep learning, flask, swift",Coursera,TensorFlow Deep Learning
Frontend Developer,"docker, java, sql, flutter, kubernetes",edX,Docker Essentials
Frontend Developer,"machine learning, kubernetes, deep learning",LinkedIn Learning,Machine Learning with Python
Backend Developer,"javascript, tensorflow, css",LinkedIn Learning,Kubernetes for Developers
Backend Developer,"pandas, kubernetes, flutter, c++",Udemy,Machine Learning with Python
Frontend Developer,"nlp, html, c++",Coursera,TensorFlow Deep Learning
DevOps Engineer,"django, swift, sql",edX,Swift Programming for iOS
Mobile App Developer,"nlp, react, html, flask",Udemy,AWS Certified Solutions Architect
Machine Learning Engineer,"kubernetes, django, tensorflow, mongodb, deep learning",Coursera,Modern JavaScript Techniques
Data Scientist,"javascript, sql, html, docker",Pluralsight,C++ Data Structures and Algorithms
Frontend Developer,"mongodb, aws, flutter, flask, tensorflow",edX,Kubernetes for Developers
Frontend Developer,"python, java, django, css",LinkedIn Learning,Flutter App Development
Data Scientist,"python, kubernetes, react",Coursera,Deep Learning Specialization
Data Scientist,"mongodb, nlp, tensorflow, sql",Coursera,Flutter App Development
Frontend Developer,"python, flask",Udemy,Machine Learning with Python
Full Stack Developer,"django, sql",edX,Docker Essentials
Machine Learning Engineer,"pandas, kubernetes",Coursera,Natural Language Processing with Python
Backend Developer,"django, java, aws, flask",Coursera,Modern JavaScript Techniques
AI Engineer,"nlp, deep learning, python",Pluralsight,Modern JavaScript Techniques
Machine Learning Engineer,"c++, java, node.js, javascript, docker",Pluralsight,Java Programming Masterclass
Full Stack Developer,"nlp, pandas",Udemy,C++ Data Structures and Algorithms
Machine Learning Engineer,"node.js, docker, python",Coursera,Java Programming Masterclass
Machine Learning Engineer,"python, node.js",LinkedIn Learning,Docker Essentials
AI Engineer,"python, aws, pandas",Pluralsight,Kubernetes for Developers
AI Engineer,"aws, swift",edX,Data Analysis with Pandas
AI Engineer,"nlp, machine learning, tensorflow",Udemy,Flask for Web Applications
AI Engineer,"kubernetes, mongodb, node.js",Pluralsight,Python for Data Science
AI Engineer,"mongodb, css, pandas",Udemy,Natural Language Processing with Python
Full Stack Developer,"html, tensorflow, aws",edX,Machine Learning with Python
Mobile App Developer,"css, kubernetes, html",Udemy,Machine Learning with Python
Backend Developer,"java, python, pandas, flutter, swift",Coursera,SQL for Data Analysis
Full Stack Developer,"deep learning, flask",Udemy,Modern JavaScript Techniques
Full Stack Developer,"node.js, nlp, tensorflow",Pluralsight,SQL for Data Analysis
Mobile App Developer,"deep learning, docker, kubernetes, flutter",Udemy,Kubernetes for Developers
DevOps Engineer,"kubernetes, javascript, node.js",Coursera,AWS Certified Solutions Architect
Frontend Developer,"kubernetes, java, html, flutter, react",edX,Kubernetes for Developers
AI Engineer,"django, docker",Pluralsight,MongoDB for Beginners
Mobile App Developer,"kubernetes, sql, node.js, java, machine learning",Pluralsight,Natural Language Processing with Python
Full Stack Developer,"kubernetes, css, aws",Pluralsight,TensorFlow Deep Learning
Backend Developer,"docker, tensorflow",Pluralsight,Node.js Backend Development
Data Scientist,"react, mongodb",LinkedIn Learning,Machine Learning with Python
Frontend Developer,"docker, css, django",edX,Kubernetes for Developers
Machine Learning Engineer,"django, java, swift",Udemy,TensorFlow Deep Learning
Data Scientist,"python, java, django, c++, javascript",LinkedIn Learning,Natural Language Processing with Python
Data Scientist,"tensorflow, flask, kubernetes",Udemy,Swift Programming for iOS
Machine Learning Engineer,"swift, javascript, python, flutter",LinkedIn Learning,Deep Learning Specialization
AI Engineer,"flutter, mongodb, aws, swift",edX,HTML5 and CSS3 Fundamentals
Backend Developer,"react, docker, machine learning, kubernetes",Udemy,SQL for Data Analysis
DevOps Engineer,"aws, node.js, docker",Udemy,Flask for Web Applications
Data Scientist,"pandas, react",Udemy,Java Programming Masterclass
Data Scientist,"tensorflow, c++, react, django, python",edX,Node.js Backend Development
Data Scientist,"c++, kubernetes, java, css, docker",edX,React Advanced Concepts
Data Scientist,"deep learning, python",Pluralsight,Natural Language Processing with Python
DevOps Engineer,"deep learning, docker, flutter, css, html",Coursera,AWS Certified Solutions Architect
Data Scientist,"c++, pandas",Coursera,Natural Language Processing with Python
AI Engineer,"python, html, sql, node.js",Pluralsight,Node.js Backend Development
Backend Developer,"node.js, java",edX,Flutter App Development
Mobile App Developer,"flask, python, css, java",LinkedIn Learning,Django Web Development
AI Engineer,"machine learning, swift",LinkedIn Learning,React Advanced Concepts
Data Scientist,"django, css",LinkedIn Learning,Machine Learning with Python
Backend Developer,"c++, react, docker, tensorflow, django",Udemy,SQL for Data Analysis
AI Engineer,"kubernetes, swift, pandas, c++, deep learning",Pluralsight,Flutter App Development
DevOps Engineer,"nlp, flutter, swift",Coursera,HTML5 and CSS3 Fundamentals
Mobile App Developer,"pandas, django, javascript",Udemy,TensorFlow Deep Learning
AI Engineer,"tensorflow, node.js, java, flutter, sql",Coursera,C++ Data Structures and Algorithms
DevOps Engineer,"swift, javascript, docker, python",LinkedIn Learning,Kubernetes for Developers
Mobile App Developer,"flask, django",Coursera,Django Web Development
Mobile App Developer,"sql, django, deep learning, python, flutter",LinkedIn Learning,AWS Certified Solutions Architect
Frontend Developer,"c++, flutter, python, mongodb, flask",Coursera,Docker Essentials
Frontend Developer,"machine learning, django, react",Pluralsight,Flutter App Development
Machine Learning Engineer,"javascript, node.js",Pluralsight,HTML5 and CSS3 Fundamentals
Backend Developer,"pandas, deep learning, swift, flask",Coursera,AWS Certified Solutions Architect
Full Stack Developer,"pandas, html",Coursera,MongoDB for Beginners
Data Scientist,"tensorflow, django, react, flask, swift",edX,Machine Learning with Python
Frontend Developer,"python, tensorflow",Coursera,Modern JavaScript Techniques
Full Stack Developer,"flutter, mongodb, html, deep learning",edX,HTML5 and CSS3 Fundamentals
AI Engineer,"machine learning, mongodb, node.js, django, flask",Pluralsight,AWS Certified Solutions Architect
Machine Learning Engineer,"sql, machine learning, html, tensorflow",Coursera,Django Web Development
Backend Developer,"django, docker, node.js, tensorflow",Coursera,Docker Essentials
DevOps Engineer,"html, python, nlp",LinkedIn Learning,Django Web Development
Mobile App Developer,"swift, deep learning",LinkedIn Learning,C++ Data Structures and Algorithms
Full Stack Developer,"tensorflow, aws, mongodb",edX,Flask for Web Applications
Data Scientist,"pandas, machine learning, c++",Coursera,TensorFlow Deep Learning
Mobile App Developer,"python, tensorflow, aws, react",Coursera,Deep Learning Specialization
AI Engineer,"machine learning, css, node.js, tensorflow",Pluralsight,MongoDB for Beginners
Full Stack Developer,"node.js, swift, sql, docker, java",edX,C++ Data Structures and Algorithms
Data Scientist,"docker, flutter",LinkedIn Learning,Natural Language Processing with Python
AI Engineer,"python, flask, swift, docker",Pluralsight,HTML5 and CSS3 Fundamentals
AI Engineer,"node.js, pandas, aws",Udemy,Kubernetes for Developers
DevOps Engineer,"docker, python, c++",edX,Natural Language Processing with Python
Backend Developer,"html, tensorflow",Udemy,Flask for Web Applications
Full Stack Developer,"pandas, aws, tensorflow, java, machine learning",Coursera,Swift Programming for iOS
Frontend Developer,"mongodb, pandas, tensorflow",LinkedIn Learning,AWS Certified Solutions Architect
Frontend Developer,"flask, css, kubernetes",LinkedIn Learning,Flutter App Development
Frontend Developer,"kubernetes, pandas",Pluralsight,TensorFlow Deep Learning
AI Engineer,"aws, java, django, react",LinkedIn Learning,TensorFlow Deep Learning
AI Engineer,"flutter, swift",LinkedIn Learning,Machine Learning with Python
Machine Learning Engineer,"react, django",Coursera,TensorFlow Deep Learning
Machine Learning Engineer,"css, mongodb, node.js, swift",Udemy,Python for Data Science
AI Engineer,"c++, html, java, deep learning",edX,Modern JavaScript Techniques
Mobile App Developer,"react, tensorflow, docker",Udemy,Flutter App Development
Data Scientist,"docker, c++, html, kubernetes",edX,Flask for Web Applications
Frontend Developer,"docker, flask",Udemy,Swift Programming for iOS
Backend Developer,"flask, react, java, c++, html",Udemy,Flutter App Development
Machine Learning Engineer,"pandas, node.js, c++",LinkedIn Learning,SQL for Data Analysis
Backend Developer,"python, html, java, nlp",Coursera,Natural Language Processing with Python
Frontend Developer,"sql, docker",Pluralsight,Natural Language Processing with Python
AI Engineer,"javascript, c++, mongodb, kubernetes, flutter",Udemy,HTML5 and CSS3 Fundamentals
Full Stack Developer,"java, mongodb, machine learning, django, css",Udemy,C++ Data Structures and Algorithms
Backend Developer,"css, flask",edX,Flask for Web Applications
Machine Learning Engineer,"node.js, kubernetes, sql, django, mongodb",Coursera,SQL for Data Analysis
Full Stack Developer,"python, css, html",Coursera,C++ Data Structures and Algorithms
Full Stack Developer,"java, pandas",LinkedIn Learning,Natural Language Processing with Python
Data Scientist,"pandas, swift, c++, html",LinkedIn Learning,TensorFlow Deep Learning
Backend Developer,"sql, c++, react",Coursera,C++ Data Structures and Algorithms
Frontend Developer,"django, html, nlp, node.js, css",Udemy,Flask for Web Applications
Mobile App Developer,"javascript, pandas, css, python",Pluralsight,Modern JavaScript Techniques
Full Stack Developer,"flask, machine learning, java, react",LinkedIn Learning,Modern JavaScript Techniques
Full Stack Developer,"flutter, html, flask, docker",Pluralsight,Machine Learning with Python
Backend Developer,"deep learning, react, pandas, css, swift",edX,HTML5 and CSS3 Fundamentals
DevOps Engineer,"deep learning, kubernetes, django",Pluralsight,Data Analysis with Pandas
Data Scientist,"kubernetes, sql",LinkedIn Learning,HTML5 and CSS3 Fundamentals
Frontend Developer,"pandas, kubernetes, swift, python",Udemy,React Advanced Concepts
Frontend Developer,"html, mongodb, css, docker, aws",Pluralsight,React Advanced Concepts
DevOps Engineer,"css, java, mongodb, swift",Coursera,Deep Learning Specialization
Frontend Developer,"machine learning, flask",edX,Data Analysis with Pandas
Data Scientist,"flask, html, react, java, machine learning",Pluralsight,TensorFlow Deep Learning
DevOps Engineer,"aws, c++",edX,Django Web Development
Backend Developer,"flask, mongodb",edX,Flutter App Development
Full Stack Developer,"node.js, java, javascript, css, react",Pluralsight,SQL for Data Analysis
AI Engineer,"nlp, pandas, django",Coursera,Machine Learning with Python
Mobile App Developer,"java, nlp",edX,Django Web Development
AI Engineer,"machine learning, nlp, tensorflow",edX,Flask for Web Applications
Data Scientist,"python, java, pandas, docker",Pluralsight,Python for Data Science
Machine Learning Engineer,"machine learning, tensorflow",Pluralsight,Kubernetes for Developers
Data Scientist,"swift, nlp, python, tensorflow, pandas",Coursera,Flutter App Development
Machine Learning Engineer,"react, aws, java, swift",Pluralsight,Machine Learning with Python
Frontend Developer,"node.js, react, css, tensorflow",LinkedIn Learning,Flask for Web Applications
AI Engineer,"nlp, c++, javascript, aws, swift",Coursera,MongoDB for Beginners
Mobile App Developer,"swift, html, machine learning, python",Udemy,AWS Certified Solutions Architect
Mobile App Developer,"java, css",edX,HTML5 and CSS3 Fundamentals
Machine Learning Engineer,"node.js, pandas, flask, machine learning, java",Pluralsight,Flutter App Development
Full Stack Developer,"c++, tensorflow",LinkedIn Learning,Flask for Web Applications
AI Engineer,"flask, node.js, c++, docker",LinkedIn Learning,MongoDB for Beginners
Machine Learning Engineer,"flask, docker",Pluralsight,MongoDB for Beginners
Frontend Developer,"machine learning, react, nlp, html",Coursera,Python for Data Science
Mobile App Developer,"deep learning, kubernetes, mongodb",Udemy,Kubernetes for Developers
Mobile App Developer,"flutter, css, django, html",LinkedIn Learning,React Advanced Concepts
Mobile App Developer,"deep learning, tensorflow",edX,Docker Essentials
Backend Developer,"mongodb, swift, javascript",edX,Modern JavaScript Techniques
Backend Developer,"react, html, tensorflow",Pluralsight,Swift Programming for iOS
Mobile App Developer,"c++, python, swift, react, tensorflow",Coursera,Node.js Backend Development
AI Engineer,"nlp, c++, javascript, pandas, django",LinkedIn Learning,Django Web Development
Machine Learning Engineer,"nlp, aws, machine learning",Udemy,Natural Language Processing with Python
Full Stack Developer,"pandas, node.js",Coursera,Java Programming Masterclass
Data Scientist,"tensorflow, java, javascript",LinkedIn Learning,Data Analysis with Pandas
Backend Developer,"nlp, deep learning, css, java",Pluralsight,Kubernetes for Developers
Mobile App Developer,"javascript, pandas",edX,Modern JavaScript Techniques
Machine Learning Engineer,"flask, docker, machine learning, c++, pandas",Udemy,HTML5 and CSS3 Fundamentals
Mobile App Developer,"kubernetes, flask, machine learning",Udemy,SQL for Data Analysis
AI Engineer,"sql, java",LinkedIn Learning,TensorFlow Deep Learning
Backend Developer,"javascript, django, kubernetes",Pluralsight,Modern JavaScript Techniques
Mobile App Developer,"c++, docker, css, python",Coursera,Machine Learning with Python
AI Engineer,"pandas, machine learning, deep learning",LinkedIn Learning,Deep Learning Specialization
AI Engineer,"deep learning, java",edX,React Advanced Concepts
Full Stack Developer,"flask, node.js, kubernetes, sql",LinkedIn Learning,Data Analysis with Pandas
DevOps Engineer,"c++, flutter, kubernetes",LinkedIn Learning,TensorFlow Deep Learning
Backend Developer,"kubernetes, swift",Pluralsight,Data Analysis with Pandas
Mobile App Developer,"deep learning, kubernetes",Udemy,React Advanced Concepts
Mobile App Developer,"deep learning, node.js, django",Pluralsight,Python for Data Science
AI Engineer,"nlp, pandas, flutter, c++, javascript",Pluralsight,Kubernetes for Developers
Frontend Developer,"swift, python, deep learning",LinkedIn Learning,Python for Data Science
Machine Learning Engineer,"react, docker, aws, tensorflow",Pluralsight,Kubernetes for Developers
Data Scientist,"javascript, tensorflow, python",Pluralsight,Data Analysis with Pandas
Backend Developer,"swift, machine learning",Pluralsight,Kubernetes for Developers
Backend Developer,"swift, flutter, css",Pluralsight,TensorFlow Deep Learning
Backend Developer,"deep learning, javascript",Coursera,Django Web Development
Data Scientist,"flutter, django, tensorflow",LinkedIn Learning,TensorFlow Deep Learning
AI Engineer,"sql, django",Udemy,AWS Certified Solutions Architect
Mobile App Developer,"python, javascript",LinkedIn Learning,Machine Learning with Python
Backend Developer,"react, java, machine learning, swift",edX,React Advanced Concepts
Data Scientist,"mongodb, java, pandas, docker, deep learning",LinkedIn Learning,Data Analysis with Pandas
Machine Learning Engineer,"sql, python, css",Udemy,Flask for Web Applications
Full Stack Developer,"django, tensorflow",Udemy,Swift Programming for iOS
DevOps Engineer,"swift, machine learning, node.js, tensorflow",LinkedIn Learning,Django Web Development
Frontend Developer,"aws, node.js, flask, deep learning",Pluralsight,Modern JavaScript Techniques
Backend Developer,"django, aws",LinkedIn Learning,AWS Certified Solutions Architect
Machine Learning Engineer,"node.js, aws",Coursera,Swift Programming for iOS
DevOps Engineer,"nlp, aws",Coursera,MongoDB for Beginners
Backend Developer,"flutter, javascript, aws, machine learning",Coursera,Kubernetes for Developers
Frontend Developer,"node.js, react, sql, pandas, machine learning",LinkedIn Learning,React Advanced Concepts
Full Stack Developer,"flutter, aws, machine learning",Coursera,Java Programming Masterclass
Data Scientist,"swift, node.js, c++, pandas, tensorflow",Coursera,Node.js Backend Development
Mobile App Developer,"kubernetes, node.js, nlp, machine learning, sql",LinkedIn Learning,SQL for Data Analysis
Machine Learning Engineer,"css, machine learning, sql, aws, c++",edX,Java Programming Masterclass
Mobile App Developer,"flask, mongodb, nlp, node.js, python",edX,Django Web Development
Mobile App Developer,"deep learning, python, java",LinkedIn Learning,AWS Certified Solutions Architect
Machine Learning Engineer,"react, python, aws",Udemy,Kubernetes for Developers
Backend Developer,"aws, docker, mongodb, deep learning",LinkedIn Learning,Docker Essentials
Frontend Developer,"tensorflow, java, flask, machine learning, css",Udemy,Kubernetes for Developers
DevOps Engineer,"deep learning, python, pandas, mongodb",LinkedIn Learning,C++ Data Structures and Algorithms
Machine Learning Engineer,"nlp, django, mongodb",LinkedIn Learning,SQL for Data Analysis
Full Stack Developer,"swift, react",Coursera,Java Programming Masterclass
Backend Developer,"html, deep learning",Udemy,Django Web Development
Frontend Developer,"flask, kubernetes, javascript, tensorflow",Coursera,Deep Learning Specialization
Data Scientist,"mongodb, python, react, kubernetes",Udemy,React Advanced Concepts
Mobile App Developer,"javascript, html, aws, c++",Pluralsight,Flutter App Development
Frontend Developer,"c++, deep learning, django, machine learning",Pluralsight,Docker Essentials
Frontend Developer,"javascript, sql, python",Pluralsight,Modern JavaScript Techniques
Machine Learning Engineer,"node.js, deep learning, react, pandas",LinkedIn Learning,TensorFlow Deep Learning
Machine Learning Engineer,"kubernetes, node.js, c++, python, mongodb",Udemy,C++ Data Structures and Algorithms
Data Scientist,"pandas, aws, node.js, kubernetes, react",edX,Deep Learning Specialization
Backend Developer,"css, django",Coursera,Django Web Development
Data Scientist,"python, java",LinkedIn Learning,Data Analysis with Pandas
Mobile App Developer,"kubernetes, nlp, java",LinkedIn Learning,Node.js Backend Development
Full Stack Developer,"html, pandas, machine learning, javascript",edX,Modern JavaScript Techniques
AI Engineer,"pandas, machine learning, tensorflow",edX,Deep Learning Specialization
DevOps Engineer,"docker, machine learning, pandas, tensorflow, javascript",Udemy,Python for Data Science
AI Engineer,"mongodb, css, flask",edX,Django Web Development
Frontend Developer,"mongodb, css",edX,MongoDB for Beginners
DevOps Engineer,"aws, swift, tensorflow, sql, machine learning",edX,HTML5 and CSS3 Fundamentals
DevOps Engineer,"node.js, tensorflow, deep learning",Pluralsight,Data Analysis with Pandas
AI Engineer,"css, pandas, docker, mongodb",edX,Flutter App Development
Frontend Developer,"javascript, java, tensorflow, deep learning, kubernetes",edX,Flutter App Development
DevOps Engineer,"docker, kubernetes",Udemy,Python for Data Science
Data Scientist,"flask, deep learning, c++",LinkedIn Learning,TensorFlow Deep Learning
Mobile App Developer,"flask, flutter, javascript, node.js, tensorflow",Coursera,React Advanced Concepts
Backend Developer,"docker, javascript, java, python",Udemy,C++ Data Structures and Algorithms
Mobile App Developer,"django, c++",edX,HTML5 and CSS3 Fundamentals
Backend Developer,"c++, javascript, flask",LinkedIn Learning,Deep Learning Specialization
Backend Developer,"nlp, swift",Pluralsight,Flutter App Development
Frontend Developer,"aws, node.js, machine learning, java",Coursera,Kubernetes for Developers
Mobile App Developer,"docker, pandas, css, django, sql",Udemy,HTML5 and CSS3 Fundamentals
Full Stack Developer,"node.js, sql, html",Coursera,Data Analysis with Pandas
Data Scientist,"flask, kubernetes, machine learning, django",LinkedIn Learning,Flutter App Development
Frontend Developer,"docker, kubernetes, react",Coursera,C++ Data Structures and Algorithms
Full Stack Developer,"kubernetes, deep learning, react, sql",edX,Kubernetes for Developers
Backend Developer,"sql, html",edX,Django Web Development
Data Scientist,"swift, java, django, nlp, c++",edX,AWS Certified Solutions Architect
Full Stack Developer,"css, node.js, docker, pandas, react",Pluralsight,Flask for Web Applications
AI Engineer,"sql, nlp, flutter, javascript",Udemy,Deep Learning Specialization
DevOps Engineer,"c++, flutter, docker, machine learning, java",edX,C++ Data Structures and Algorithms
AI Engineer,"pandas, java",Coursera,Natural Language Processing with Python
Backend Developer,"node.js, swift, sql, pandas",LinkedIn Learning,Natural Language Processing with Python
Full Stack Developer,"deep learning, docker",edX,TensorFlow Deep Learning
Frontend Developer,"pandas, swift, docker",LinkedIn Learning,Flask for Web Applications
Frontend Developer,"node.js, c++",Udemy,Machine Learning with Python
Mobile App Developer,"kubernetes, flask, swift, css, react",LinkedIn Learning,C++ Data Structures and Algorithms
Machine Learning Engineer,"machine learning, docker, c++",Coursera,HTML5 and CSS3 Fundamentals
Backend Developer,"mongodb, react, nlp, flask",edX,Java Programming Masterclass
DevOps Engineer,"flask, css, pandas",Coursera,Modern JavaScript Techniques
Data Scientist,"python, c++",Coursera,Flask for Web Applications
Frontend Developer,"sql, css, react, django",LinkedIn Learning,Data Analysis with Pandas
DevOps Engineer,"aws, swift, css",edX,Java Programming Masterclass
Backend Developer,"sql, javascript, flask, node.js",Coursera,Modern JavaScript Techniques
Machine Learning Engineer,"java, docker, machine learning, python",LinkedIn Learning,HTML5 and CSS3 Fundamentals
Backend Developer,"swift, docker, tensorflow, node.js, css",Coursera,AWS Certified Solutions Architect
Backend Developer,"java, pandas, javascript, flask, docker",Udemy,SQL for Data Analysis
Full Stack Developer,"swift, c++, docker, css, flutter",Coursera,Deep Learning Specialization
Mobile App Developer,"css, node.js, sql, deep learning, flutter",LinkedIn Learning,Modern JavaScript Techniques
Data Scientist,"javascript, css, deep learning, nlp, sql",Udemy,Swift Programming for iOS
Frontend Developer,"aws, docker, c++, django, python",Pluralsight,Flutter App Development
Mobile App Developer,"kubernetes, javascript, flutter, nlp",Coursera,Java Programming Masterclass
Full Stack Developer,"kubernetes, java, pandas",LinkedIn Learning,AWS Certified Solutions Architect
Full Stack Developer,"node.js, flask, java, deep learning",LinkedIn Learning,Natural Language Processing with Python
Backend Developer,"react, java, c++",Coursera,MongoDB for Beginners
Machine Learning Engineer,"nlp, flutter, docker, flask, tensorflow",LinkedIn Learning,Python for Data Science
Mobile App Developer,"sql, c++, docker, javascript",Coursera,HTML5 and CSS3 Fundamentals
Backend Developer,"kubernetes, react, tensorflow, swift, sql",Udemy,TensorFlow Deep Learning
AI Engineer,"tensorflow, machine learning, sql",Udemy,Docker Essentials
Frontend Developer,"aws, flutter",LinkedIn Learning,Java Programming Masterclass
Frontend Developer,"pandas, swift, machine learning, python",Pluralsight,TensorFlow Deep Learning
Machine Learning Engineer,"node.js, css, deep learning, machine learning, sql",edX,MongoDB for Beginners
Backend Developer,"c++, django",edX,Java Programming Masterclass
Frontend Developer,"kubernetes, c++",LinkedIn Learning,Node.js Backend Development
AI Engineer,"django, react, flask, machine learning",edX,Java Programming Masterclass
DevOps Engineer,"flutter, swift, java",edX,Flutter App Development
Full Stack Developer,"machine learning, aws",Coursera,C++ Data Structures and Algorithms
