Job Title,Known Skills,Platform,Course Title
Machine Learning Engineer,"node.js, django, css, mongodb",Udemy,Machine Learning with Python
AI Engineer,"nlp, django, docker, react",edX,Node.js Backend Development
DevOps Engineer,"django, deep learning, aws, java, python",Pluralsight,Natural Language Processing with Python
AI Engineer,"c++, machine learning, javascript",Pluralsight,TensorFlow Deep Learning
Machine Learning Engineer,"tensorflow, html, css",Pluralsight,Modern JavaScript Techniques
DevOps Engineer,"aws, css",LinkedIn Learning,Natural Language Processing with Python
Machine Learning Engineer,"java, pandas, sql, docker, swift",LinkedIn Learning,Deep Learning Specialization
Frontend Developer,"deep learning, flask",edX,Swift Programming for iOS
Backend Developer,"sql, react",Pluralsight,SQL for Data Analysis
Backend Developer,"docker, pandas, tensorflow, html, java",edX,Node.js Backend Development
Machine Learning Engineer,"java, machine learning, html",LinkedIn Learning,Deep Learning Specialization
Full Stack Developer,"django, docker, kubernetes",Udemy,React Advanced Concepts
AI Engineer,"html, machine learning, javascript, aws, c++",Coursera,Docker Essentials
Full Stack Developer,"css, pandas",Pluralsight,Machine Learning with Python
Machine Learning Engineer,"react, django, flutter, css, javascript",Udemy,Node.js Backend Development
Frontend Developer,"swift, flutter, node.js, tensorflow",Coursera,Python for Data Science
Backend Developer,"pandas, mongodb, c++",Coursera,AWS Certified Solutions Architect
Frontend Developer,"tensorflow, machine learning, mongodb, javascript",Pluralsight,Natural Language Processing with Python
Frontend Developer,"html, python, sql, pandas",edX,Data Analysis with Pandas
Machine Learning Engineer,"swift, html",Coursera,C++ Data Structures and Algorithms
Machine Learning Engineer,"flutter, node.js, deep learning, react",LinkedIn Learning,SQL for Data Analysis
DevOps Engineer,"css, react, swift, java, aws",Udemy,C++ Data Structures and Algorithms
Mobile App Developer,"pandas, nlp, node.js",edX,Node.js Backend Development
AI Engineer,"aws, docker, html, swift",LinkedIn Learning,React Advanced Concepts
Data Scientist,"flask, flutter, sql",Coursera,Node.js Backend Development
Data Scientist,"aws, c++, swift, html, flutter",Udemy,Flutter App Development
Machine Learning Engineer,"nlp, kubernetes, python, machine learning",LinkedIn Learning,Flask for Web Applications
DevOps Engineer,"flutter, nlp",edX,React Advanced Concepts
Backend Developer,"docker, javascript",edX,Flutter App Development
Mobile App Developer,"pandas, swift, django",Pluralsight,SQL for Data Analysis
Full Stack Developer,"docker, sql",Coursera,Docker Essentials
Machine Learning Engineer,"swift, machine learning",Coursera,Docker Essentials
Machine Learning Engineer,"deep learning, html",Udemy,HTML5 and CSS3 Fundamentals
Machine Learning Engineer,"flutter, node.js, javascript, pandas, css",LinkedIn Learning,Kubernetes for Developers
Backend Developer,"flask, deep learning",Udemy,React Advanced Concepts
Backend Developer,"mongodb, node.js, django, swift",LinkedIn Learning,Deep Learning Specialization
Machine Learning Engineer,"java, tensorflow, css",LinkedIn Learning,Data Analysis with Pandas
DevOps Engineer,"react, css",LinkedIn Learning,Modern JavaScript Techniques
Mobile App Developer,"tensorflow, pandas",Coursera,Kubernetes for Developers
Mobile App Developer,"nlp, react",Pluralsight,Swift Programming for iOS
Full Stack Developer,"css, django, pandas, flutter, aws",Udemy,Flask for Web Applications
Backend Developer,"css, javascript, aws",Coursera,C++ Data Structures and Algorithms
Machine Learning Engineer,"nlp, java",LinkedIn Learning,Node.js Backend Development
Mobile App Developer,"aws, flask, nlp, javascript",edX,Swift Programming for iOS
Frontend Developer,"deep learning, django, machine learning, pandas, swift",LinkedIn Learning,Deep Learning Specialization
DevOps Engineer,"python, java, flutter, c++",LinkedIn Learning,Swift Programming for iOS
Frontend Developer,"swift, python, docker",Udemy,AWS Certified Solutions Architect
Backend Developer,"html, c++",Udemy,TensorFlow Deep Learning
Full Stack Developer,"sql, c++, python, javascript, flutter",Coursera,Node.js Backend Development
Machine Learning Engineer,"swift, flask, django, css",Coursera,MongoDB for Beginners
DevOps Engineer,"javascript, deep learning, mongodb, kubernetes",Coursera,Deep Learning Specialization
AI Engineer,"deep learning, machine learning",Udemy,Kubernetes for Developers
AI Engineer,"flask, django, swift",edX,Swift Programming for iOS
Frontend Developer,"deep learning, flask, javascript, c++",Coursera,SQL for Data Analysis
Mobile App Developer,"mongodb, flask, css",Coursera,Deep Learning Specialization
DevOps Engineer,"deep learning, react, kubernetes, aws",LinkedIn Learning,Flutter App Development
AI Engineer,"nlp, docker, python",Pluralsight,TensorFlow Deep Learning
AI Engineer,"python, machine learning",Udemy,Flask for Web Applications
Data Scientist,"java, c++, machine learning",Udemy,Modern JavaScript Techniques
Data Scientist,"aws, docker, flask, django",Pluralsight,TensorFlow Deep Learning
Backend Developer,"pandas, tensorflow, kubernetes, machine learning, django",Coursera,Python for Data Science
DevOps Engineer,"java, python, kubernetes, machine learning",edX,Django Web Development
Mobile App Developer,"java, javascript, html, node.js, machine learning",Pluralsight,HTML5 and CSS3 Fundamentals
DevOps Engineer,"react, python, tensorflow, machine learning",edX,React Advanced Concepts
Backend Developer,"flutter, python",Coursera,C++ Data Structures and Algorithms
Frontend Developer,"flask, html, python",Udemy,Modern JavaScript Techniques
DevOps Engineer,"css, python",edX,Kubernetes for Developers
Data Scientist,"flask, kubernetes, docker",Udemy,Flask for Web Applications
Backend Developer,"html, kubernetes, mongodb",LinkedIn Learning,Django Web Development
Data Scientist,"python, deep learning, aws",Coursera,Flutter App Development
AI Engineer,"html, swift, flutter, sql, aws",LinkedIn Learning,Natural Language Processing with Python
Frontend Developer,"flask, nlp, c++, react, docker",edX,HTML5 and CSS3 Fundamentals
Frontend Developer,"python, node.js, java, react",edX,Natural Language Processing with Python
AI Engineer,"react, css, c++, docker, kubernetes",LinkedIn Learning,MongoDB for Beginners
Full Stack Developer,"tensorflow, flutter, javascript",Udemy,Data Analysis with Pandas
AI Engineer,"sql, javascript, html, node.js, aws",edX,Deep Learning Specialization
DevOps Engineer,"deep learning, mongodb, node.js",edX,Node.js Backend Development
DevOps Engineer,"flask, sql, java, flutter",Coursera,Flask for Web Applications
Mobile App Developer,"nlp, sql, javascript",Udemy,C++ Data Structures and Algorithms
AI Engineer,"css, flask, c++",Pluralsight,Modern JavaScript Techniques
DevOps Engineer,"mongodb, java, python, docker, deep learning",Pluralsight,React Advanced Concepts
Backend Developer,"html, python, flask, kubernetes",edX,HTML5 and CSS3 Fundamentals
AI Engineer,"flutter, docker",edX,Swift Programming for iOS
DevOps Engineer,"sql, java, docker",Coursera,Java Programming Masterclass
Machine Learning Engineer,"java, c++, flask, sql, html",Udemy,MongoDB for Beginners
Backend Developer,"python, aws, tensorflow, kubernetes, css",Coursera,Modern JavaScript Techniques
DevOps Engineer,"deep learning, nlp",edX,Java Programming Masterclass
Full Stack Developer,"kubernetes, deep learning, docker, html",LinkedIn Learning,Flutter App Development
Data Scientist,"tensorflow, javascript, mongodb",Coursera,TensorFlow Deep Learning
Backend Developer,"sql, machine learning, flutter",LinkedIn Learning,TensorFlow Deep Learning
AI Engineer,"swift, django, docker",Pluralsight,HTML5 and CSS3 Fundamentals
AI Engineer,"machine learning, react, swift",Pluralsight,Data Analysis with Pandas
DevOps Engineer,"java, python, kubernetes, swift",Udemy,Deep Learning Specialization
Mobile App Developer,"html, node.js, python, css, sql",Pluralsight,Node.js Backend Development
Full Stack Developer,"nlp, machine learning",edX,Flask for Web Applications
Mobile App Developer,"javascript, c++, react, deep learning, swift",edX,Python for Data Science
Backend Developer,"python, docker, django",Udemy,Django Web Development
Frontend Developer,"javascript, css",Udemy,AWS Certified Solutions Architect
Frontend Developer,"python, docker, java, flutter, kubernetes",edX,Natural Language Processing with Python
Machine Learning Engineer,"node.js, docker, java, pandas",LinkedIn Learning,Flask for Web Applications
Frontend Developer,"docker, css, html",Udemy,React Advanced Concepts
DevOps Engineer,"css, flask",Pluralsight,Data Analysis with Pandas
Backend Developer,"node.js, flutter, sql, javascript, aws",Udemy,C++ Data Structures and Algorithms
AI Engineer,"mongodb, kubernetes, c++",Pluralsight,AWS Certified Solutions Architect
Mobile App Developer,"flask, nlp, mongodb",edX,Modern JavaScript Techniques
Frontend Developer,"django, sql",Pluralsight,C++ Data Structures and Algorithms
Frontend Developer,"c++, javascript, css, aws",Udemy,MongoDB for Beginners
Backend Developer,"node.js, machine learning, nlp, flutter, python",edX,Java Programming Masterclass
Data Scientist,"swift, react",Coursera,Django Web Development
Data Scientist,"javascript, flutter",Coursera,TensorFlow Deep Learning
Mobile App Developer,"react, sql, aws",LinkedIn Learning,Modern JavaScript Techniques
Data Scientist,"html, tensorflow",edX,React Advanced Concepts
Data Scientist,"aws, node.js, sql",Pluralsight,TensorFlow Deep Learning
Machine Learning Engineer,"tensorflow, pandas, c++, sql, kubernetes",LinkedIn Learning,Java Programming Masterclass
Data Scientist,"sql, node.js, flask",Coursera,Node.js Backend Development
Data Scientist,"html, swift, flask, css, aws",edX,Java Programming Masterclass
Machine Learning Engineer,"html, django, java",edX,Machine Learning with Python
AI Engineer,"docker, css, pandas",Coursera,SQL for Data Analysis
Data Scientist,"django, tensorflow, nlp",Udemy,React Advanced Concepts
Machine Learning Engineer,"tensorflow, flask, nlp",Udemy,TensorFlow Deep Learning
Data Scientist,"docker, pandas, flutter",Coursera,React Advanced Concepts
Frontend Developer,"kubernetes, tensorflow, python",Udemy,Java Programming Masterclass
Machine Learning Engineer,"kubernetes, tensorflow, docker, python",LinkedIn Learning,Python for Data Science
Data Scientist,"kubernetes, sql, mongodb, python, java",Udemy,Docker Essentials
Full Stack Developer,"java, javascript",Coursera,Natural Language Processing with Python
Full Stack Developer,"javascript, docker",Udemy,Data Analysis with Pandas
DevOps Engineer,"python, tensorflow, html, kubernetes",edX,Modern JavaScript Techniques
AI Engineer,"django, kubernetes, css, flutter, machine learning",Coursera,React Advanced Concepts
Mobile App Developer,"kubernetes, c++, java",Pluralsight,Swift Programming for iOS
Mobile App Developer,"html, aws, javascript",edX,Natural Language Processing with Python
Data Scientist,"tensorflow, swift",LinkedIn Learning,SQL for Data Analysis
Machine Learning Engineer,"javascript, docker, python",Udemy,Data Analysis with Pandas
AI Engineer,"mongodb, machine learning, css, pandas, nlp",Pluralsight,Django Web Development
Backend Developer,"html, docker",edX,Docker Essentials
DevOps Engineer,"javascript, python",Coursera,SQL for Data Analysis
Backend Developer,"swift, deep learning, mongodb",Pluralsight,Modern JavaScript Techniques
DevOps Engineer,"node.js, sql",edX,React Advanced Concepts
DevOps Engineer,"java, html",Pluralsight,Docker Essentials
Backend Developer,"c++, css",LinkedIn Learning,Node.js Backend Development
AI Engineer,"kubernetes, pandas, machine learning, javascript, mongodb",edX,Data Analysis with Pandas
Backend Developer,"sql, aws, django",Coursera,Data Analysis with Pandas
Data Scientist,"aws, nlp, docker, c++",Coursera,Django Web Development
Machine Learning Engineer,"html, swift, pandas, django",Udemy,Natural Language Processing with Python
Data Scientist,"mongodb, django, tensorflow, sql, aws",edX,TensorFlow Deep Learning
Full Stack Developer,"deep learning, tensorflow, swift, node.js",Coursera,Kubernetes for Developers
Machine Learning Engineer,"machine learning, java",edX,Django Web Development
Backend Developer,"swift, mongodb, tensorflow, javascript",Coursera,Django Web Development
Data Scientist,"swift, deep learning, css, python, mongodb",Udemy,Django Web Development
Mobile App Developer,"nlp, django",Coursera,Django Web Development
Data Scientist,"sql, flask, pandas",Pluralsight,AWS Certified Solutions Architect
DevOps Engineer,"java, react, deep learning, swift, c++",Coursera,Machine Learning with Python
AI Engineer,"c++, sql",LinkedIn Learning,MongoDB for Beginners
Mobile App Developer,"nlp, mongodb, node.js, tensorflow, kubernetes",edX,Swift Programming for iOS
Machine Learning Engineer,"django, sql",Pluralsight,MongoDB for Beginners
Data Scientist,"html, node.js, flask, kubernetes, mongodb",LinkedIn Learning,Natural Language Processing with Python
Backend Developer,"django, docker",Udemy,TensorFlow Deep Learning
AI Engineer,"python, nlp",Coursera,Java Programming Masterclass
Frontend Developer,"tensorflow, javascript, swift, html, django",LinkedIn Learning,Machine Learning with Python
Mobile App Developer,"html, machine learning",Udemy,AWS Certified Solutions Architect
Frontend Developer,"nlp, java",Pluralsight,Python for Data Science
DevOps Engineer,"python, java, flutter",LinkedIn Learning,Java Programming Masterclass
Backend Developer,"react, pandas, mongodb",Pluralsight,Flutter App Development
Backend Developer,"machine learning, javascript, django",edX,Flutter App Development
Mobile App Developer,"swift, django",LinkedIn Learning,Machine Learning with Python
Mobile App Developer,"aws, html",edX,Node.js Backend Development
Machine Learning Engineer,"react, deep learning, pandas, docker, css",edX,SQL for Data Analysis
Backend Developer,"java, node.js, html",edX,Kubernetes for Developers
Frontend Developer,"nlp, tensorflow, java",LinkedIn Learning,Kubernetes for Developers
Backend Developer,"swift, flutter",edX,Java Programming Masterclass
DevOps Engineer,"machine learning, node.js",Pluralsight,Node.js Backend Development
Frontend Developer,"swift, tensorflow, flutter",edX,Node.js Backend Development
DevOps Engineer,"sql, mongodb, html, css, kubernetes",edX,Data Analysis with Pandas
Machine Learning Engineer,"react, tensorflow, swift, flask",Pluralsight,Deep Learning Specialization
Data Scientist,"c++, python, docker, swift, flask",Pluralsight,React Advanced Concepts
Machine Learning Engineer,"html, react, c++",Udemy,SQL for Data Analysis
Data Scientist,"pandas, react, javascript, sql, deep learning",Udemy,Swift Programming for iOS
Full Stack Developer,"react, deep learning, html",Pluralsight,Swift Programming for iOS
DevOps Engineer,"machine learning, kubernetes",edX,Python for Data Science
Full Stack Developer,"mongodb, machine learning, java, docker, react",Udemy,Flutter App Development
Mobile App Developer,"c++, java, deep learning, nlp, flutter",LinkedIn Learning,HTML5 and CSS3 Fundamentals
Mobile App Developer,"swift, react, django, html, deep learning",edX,Java Programming Masterclass
Data Scientist,"deep learning, django, javascript, aws, java",LinkedIn Learning,AWS Certified Solutions Architect
Machine Learning Engineer,"python, django, kubernetes",Coursera,Modern JavaScript Techniques
Mobile App Developer,"docker, swift, node.js, nlp",edX,Machine Learning with Python
Frontend Developer,"python, machine learning, sql",Coursera,C++ Data Structures and Algorithms
Full Stack Developer,"node.js, flask",Udemy,Node.js Backend Development
Frontend Developer,"mongodb, sql, kubernetes, tensorflow, python",LinkedIn Learning,Node.js Backend Development
Full Stack Developer,"sql, kubernetes",Coursera,Natural Language Processing with Python
Full Stack Developer,"flutter, nlp, html, aws, node.js",edX,Data Analysis with Pandas
Mobile App Developer,"kubernetes, tensorflow, html, node.js, react",Udemy,Natural Language Processing with Python
Mobile App Developer,"deep learning, c++, pandas, aws, swift",edX,Flask for Web Applications
DevOps Engineer,"tensorflow, kubernetes",edX,SQL for Data Analysis
AI Engineer,"java, django, kubernetes",Pluralsight,Java Programming Masterclass
Frontend Developer,"java, django, docker, css, tensorflow",Coursera,HTML5 and CSS3 Fundamentals
Frontend Developer,"pandas, java, machine learning, swift, javascript",Coursera,Data Analysis with Pandas
AI Engineer,"aws, c++",LinkedIn Learning,Swift Programming for iOS
Backend Developer,"react, javascript, django, docker, deep learning",Pluralsight,AWS Certified Solutions Architect
Frontend Developer,"machine learning, mongodb, css",Coursera,Node.js Backend Development
Full Stack Developer,"flutter, deep learning",Coursera,MongoDB for Beginners
Backend Developer,"flask, swift, aws, nlp, kubernetes",edX,AWS Certified Solutions Architect
DevOps Engineer,"react, html, pandas, python",LinkedIn Learning,Flask for Web Applications
Full Stack Developer,"machine learning, kubernetes, nlp, flutter, mongodb",Udemy,C++ Data Structures and Algorithms
Mobile App Developer,"aws, java, html",Coursera,Natural Language Processing with Python
AI Engineer,"c++, mongodb, tensorflow",Udemy,Python for Data Science
Machine Learning Engineer,"css, flask",edX,Natural Language Processing with Python
Backend Developer,"pandas, c++, sql, swift, flask",Pluralsight,Java Programming Masterclass
Data Scientist,"tensorflow, nlp",Udemy,Docker Essentials
DevOps Engineer,"sql, kubernetes",LinkedIn Learning,Python for Data Science
Data Scientist,"pandas, nlp, css, html, flask",LinkedIn Learning,Flutter App Development
Mobile App Developer,"pandas, node.js",edX,React Advanced Concepts
Frontend Developer,"swift, deep learning, kubernetes, javascript",LinkedIn Learning,SQL for Data Analysis
Data Scientist,"c++, css, sql, django, flutter",Coursera,Data Analysis with Pandas
Frontend Developer,"deep learning, java, javascript, react",Pluralsight,Docker Essentials
Frontend Developer,"nlp, flask",Udemy,Natural Language Processing with Python
Full Stack Developer,"python, css",Udemy,Java Programming Masterclass
AI Engineer,"django, react, kubernetes, mongodb",edX,Python for Data Science
Backend Developer,"deep learning, django, docker, javascript",Coursera,Kubernetes for Developers
Frontend Developer,"machine learning, aws, nlp",Udemy,Data Analysis with Pandas
Mobile App Developer,"machine learning, kubernetes, swift",edX,Natural Language Processing with Python
Backend Developer,"react, docker, machine learning",Pluralsight,React Advanced Concepts
Backend Developer,"sql, aws, java, nlp",Coursera,React Advanced Concepts
Mobile App Developer,"sql, react, css, java",edX,Node.js Backend Development
DevOps Engineer,"mongodb, html, java, flask, node.js",Udemy,Natural Language Processing with Python
Full Stack Developer,"node.js, react, c++, pandas",edX,Docker Essentials
DevOps Engineer,"kubernetes, c++",Coursera,MongoDB for Beginners
Mobile App Developer,"react, docker, sql",Coursera,Node.js Backend Development
Frontend Developer,"django, mongodb, css, kubernetes, java",edX,Modern JavaScript Techniques
Full Stack Developer,"sql, mongodb, css",Udemy,React Advanced Concepts
AI Engineer,"c++, flutter, sql, swift",LinkedIn Learning,Docker Essentials
AI Engineer,"deep learning, sql, nlp",Udemy,HTML5 and CSS3 Fundamentals
Machine Learning Engineer,"flask, machine learning, java, html, javascript",Udemy,React Advanced Concepts
Mobile App Developer,"flutter, react, mongodb",Udemy,Flutter App Development
Backend Developer,"css, c++",Coursera,Flutter App Development
Mobile App Developer,"docker, javascript, flask",Coursera,Flask for Web Applications
AI Engineer,"css, pandas, javascript, aws, kubernetes",edX,MongoDB for Beginners
Backend Developer,"java, docker, react, c++",LinkedIn Learning,Deep Learning Specialization
Mobile App Developer,"django, kubernetes, machine learning, flutter",Coursera,AWS Certified Solutions Architect
AI Engineer,"deep learning, aws, react, node.js, django",LinkedIn Learning,Deep Learning Specialization
Frontend Developer,"tensorflow, flask, nlp",Coursera,Modern JavaScript Techniques
Full Stack Developer,"flutter, mongodb, c++",Coursera,AWS Certified Solutions Architect
Data Scientist,"css, nlp, html, react",Pluralsight,Node.js Backend Development
Backend Developer,"react, django",Pluralsight,MongoDB for Beginners
Data Scientist,"pandas, html, aws, tensorflow",edX,React Advanced Concepts
DevOps Engineer,"swift, mongodb, pandas, python",Udemy,AWS Certified Solutions Architect
AI Engineer,"node.js, flutter",Coursera,MongoDB for Beginners
DevOps Engineer,"javascript, tensorflow, machine learning",LinkedIn Learning,HTML5 and CSS3 Fundamentals
DevOps Engineer,"nlp, javascript",Udemy,AWS Certified Solutions Architect
AI Engineer,"flask, deep learning",edX,Natural Language Processing with Python
DevOps Engineer,"html, mongodb, django, tensorflow, python",Coursera,React Advanced Concepts
Machine Learning Engineer,"sql, css",Pluralsight,C++ Data Structures and Algorithms
Frontend Developer,"nlp, c++, swift, css, sql",Pluralsight,Docker Essentials
Machine Learning Engineer,"sql, react, java, mongodb",Pluralsight,Docker Essentials
DevOps Engineer,"c++, mongodb, tensorflow, pandas, flutter",Udemy,C++ Data Structures and Algorithms
Data Scientist,"machine learning, django",Pluralsight,Swift Programming for iOS
Backend Developer,"java, pandas, css, nlp, javascript",edX,Docker Essentials
Full Stack Developer,"kubernetes, aws, pandas",Pluralsight,TensorFlow Deep Learning
DevOps Engineer,"swift, react, docker, node.js, kubernetes",LinkedIn Learning,Docker Essentials
AI Engineer,"pandas, javascript, tensorflow, swift, c++",LinkedIn Learning,Data Analysis with Pandas
Data Scientist,"docker, c++, aws",Udemy,HTML5 and CSS3 Fundamentals
AI Engineer,"nlp, django, flask, pandas",edX,Flutter App Development
Mobile App Developer,"machine learning, docker, react, java, nlp",Coursera,Docker Essentials
DevOps Engineer,"aws, react, docker, node.js",LinkedIn Learning,Python for Data Science
Mobile App Developer,"mongodb, python, flutter",LinkedIn Learning,Python for Data Science
Data Scientist,"mongodb, swift",Coursera,Deep Learning Specialization
Full Stack Developer,"mongodb, css, pandas, django, python",Pluralsight,Deep Learning Specialization
Machine Learning Engineer,"tensorflow, sql, react",Pluralsight,Kubernetes for Developers
AI Engineer,"javascript, sql, mongodb, node.js",LinkedIn Learning,AWS Certified Solutions Architect
Backend Developer,"tensorflow, html, machine learning",edX,Java Programming Masterclass
Mobile App Developer,"mongodb, sql",Udemy,Flutter App Development
Full Stack Developer,"nlp, aws",LinkedIn Learning,AWS Certified Solutions Architect
Mobile App Developer,"node.js, sql",Pluralsight,Flask for Web Applications
Frontend Developer,"machine learning, sql, aws",edX,Deep Learning Specialization
DevOps Engineer,"react, swift",Coursera,HTML5 and CSS3 Fundamentals
Data Scientist,"kubernetes, javascript, swift, docker, node.js",edX,HTML5 and CSS3 Fundamentals
Full Stack Developer,"nlp, flutter",LinkedIn Learning,Node.js Backend Development
Data Scientist,"kubernetes, tensorflow, python, deep learning, react",Pluralsight,Java Programming Masterclass
Frontend Developer,"django, nlp, machine learning, pandas, css",Pluralsight,Kubernetes for Developers
AI Engineer,"html, javascript, nlp, mongodb",LinkedIn Learning,React Advanced Concepts
Full Stack Developer,"docker, pandas, machine learning",Udemy,Node.js Backend Development
Mobile App Developer,"javascript, machine learning, kubernetes, mongodb, tensorflow",Pluralsight,Java Programming Masterclass
DevOps Engineer,"react, c++",Pluralsight,Machine Learning with Python
Frontend Developer,"javascript, mongodb, swift",LinkedIn Learning,Modern JavaScript Techniques
Full Stack Developer,"css, kubernetes",Coursera,MongoDB for Beginners
Data Scientist,"nlp, flask, react, pandas, kubernetes",Pluralsight,Flutter App Development
Machine Learning Engineer,"html, react, swift",Coursera,Flutter App Development
Machine Learning Engineer,"flutter, html, node.js, docker",Udemy,SQL for Data Analysis
Full Stack Developer,"mongodb, kubernetes, java, html, python",LinkedIn Learning,C++ Data Structures and Algorithms
Backend Developer,"html, aws",Udemy,Flask for Web Applications
Backend Developer,"machine learning, react",edX,Node.js Backend Development
Mobile App Developer,"node.js, django, deep learning, sql",Pluralsight,Data Analysis with Pandas
Backend Developer,"pandas, tensorflow",edX,Deep Learning Specialization
Machine Learning Engineer,"sql, pandas, javascript, java",Udemy,MongoDB for Beginners
Full Stack Developer,"flask, pandas, html",Coursera,SQL for Data Analysis
Frontend Developer,"kubernetes, aws",edX,Flutter App Development
Machine Learning Engineer,"docker, java, javascript, css, mongodb",Udemy,Django Web Development
Mobile App Developer,"nlp, tensorflow, machine learning, flask",Coursera,Deep Learning Specialization
Backend Developer,"docker, pandas, tensorflow, java, mongodb",Pluralsight,Swift Programming for iOS
Data Scientist,"react, docker",LinkedIn Learning,Kubernetes for Developers
Machine Learning Engineer,"django, python",Coursera,Data Analysis with Pandas
Mobile App Developer,"deep learning, c++, nlp",Coursera,Django Web Development
AI Engineer,"docker, java, python",Udemy,Kubernetes for Developers
Frontend Developer,"kubernetes, mongodb, css",LinkedIn Learning,Java Programming Masterclass
Machine Learning Engineer,"kubernetes, css",Pluralsight,MongoDB for Beginners
Data Scientist,"swift, javascript, aws",Coursera,Docker Essentials
Backend Developer,"nlp, machine learning",LinkedIn Learning,Modern JavaScript Techniques
DevOps Engineer,"kubernetes, c++, flutter",Pluralsight,Python for Data Science
