Job Title,Known Skills,Platform,Course Title
Mobile App Developer,"python, sql",Coursera,C++ Data Structures and Algorithms
DevOps Engineer,"html, python, mongodb, flutter, java",LinkedIn Learning,React Advanced Concepts
Frontend Developer,"node.js, swift",LinkedIn Learning,Flutter App Development
Full Stack Developer,"pandas, nlp",Coursera,Machine Learning with Python
DevOps Engineer,"mongodb, machine learning, c++, html",Coursera,TensorFlow Deep Learning
Mobile App Developer,"mongodb, flutter",Udemy,TensorFlow Deep Learning
Full Stack Developer,"sql, react, tensorflow, django",Pluralsight,Swift Programming for iOS
Backend Developer,"nlp, sql, flutter, pandas",Udemy,Node.js Backend Development
Mobile App Developer,"docker, c++, machine learning",Coursera,Data Analysis with Pandas
Frontend Developer,"flask, java, c++",Udemy,TensorFlow Deep Learning
Backend Developer,"java, swift, html, pandas",LinkedIn Learning,Java Programming Masterclass
Data Scientist,"javascript, react, python",Coursera,TensorFlow Deep Learning
Frontend Developer,"django, html, deep learning, nlp, mongodb",edX,Django Web Development
AI Engineer,"flutter, html, java, docker",Udemy,Kubernetes for Developers
Data Scientist,"flutter, pandas, mongodb",Coursera,Flask for Web Applications
AI Engineer,"kubernetes, aws, html, mongodb",Pluralsight,Flask for Web Applications
Data Scientist,"swift, flask, javascript, machine learning",LinkedIn Learning,Modern JavaScript Techniques
AI Engineer,"css, flutter, sql, flask, c++",edX,Modern JavaScript Techniques
DevOps Engineer,"css, flask, machine learning",Pluralsight,Flutter App Development
Backend Developer,"css, sql, nlp",edX,C++ Data Structures and Algorithms
Mobile App Developer,"machine learning, docker, html, sql, deep learning",LinkedIn Learning,Java Programming Masterclass
Data Scientist,"python, swift, django, nlp, java",Coursera,Docker Essentials
Backend Developer,"node.js, deep learning",edX,Modern JavaScript Techniques
Machine Learning Engineer,"mongodb, swift, kubernetes, aws",Coursera,MongoDB for Beginners
Frontend Developer,"nlp, tensorflow, sql, kubernetes",Coursera,Docker Essentials
Frontend Developer,"mongodb, django, aws",edX,Flutter App Development
DevOps Engineer,"python, mongodb, react, tensorflow",Udemy,Django Web Development
Mobile App Developer,"aws, java, sql, css, flutter",Pluralsight,TensorFlow Deep Learning
Frontend Developer,"node.js, html",Coursera,Data Analysis with Pandas
Backend Developer,"flask, pandas, flutter",Coursera,Deep Learning Specialization
Backend Developer,"nlp, flask, react",Udemy,Data Analysis with Pandas
Machine Learning Engineer,"pandas, swift, django",LinkedIn Learning,Data Analysis with Pandas
Backend Developer,"docker, django, java, mongodb",Udemy,MongoDB for Beginners
Backend Developer,"aws, html, tensorflow, kubernetes",Coursera,Python for Data Science
Full Stack Developer,"django, tensorflow, docker, nlp, javascript",Udemy,Node.js Backend Development
Backend Developer,"machine learning, tensorflow",Pluralsight,Data Analysis with Pandas
DevOps Engineer,"css, java, javascript, python",Pluralsight,Deep Learning Specialization
Backend Developer,"c++, aws, css",edX,Node.js Backend Development
Data Scientist,"react, deep learning, pandas",Udemy,C++ Data Structures and Algorithms
Mobile App Developer,"pandas, c++, deep learning, mongodb, tensorflow",LinkedIn Learning,AWS Certified Solutions Architect
Frontend Developer,"sql, css, pandas",LinkedIn Learning,Node.js Backend Development
Data Scientist,"kubernetes, deep learning, react",Udemy,Flask for Web Applications
Data Scientist,"flask, react, css",LinkedIn Learning,Swift Programming for iOS
Machine Learning Engineer,"c++, flutter, html, node.js, mongodb",Coursera,Flask for Web Applications
Full Stack Developer,"flask, nlp, html, swift, deep learning",Coursera,Machine Learning with Python
Backend Developer,"tensorflow, flask",Udemy,Django Web Development
Full Stack Developer,"javascript, python, swift, pandas, flask",LinkedIn Learning,React Advanced Concepts
Data Scientist,"machine learning, sql",Pluralsight,Django Web Development
Mobile App Developer,"pandas, python",Coursera,Django Web Development
Full Stack Developer,"flask, sql",LinkedIn Learning,Node.js Backend Development
Frontend Developer,"flask, node.js",Pluralsight,Flutter App Development
Frontend Developer,"html, css, django",edX,C++ Data Structures and Algorithms
Frontend Developer,"flask, flutter, c++, html",Coursera,Deep Learning Specialization
Backend Developer,"react, flutter, mongodb",edX,Django Web Development
Machine Learning Engineer,"c++, python",Pluralsight,Deep Learning Specialization
Frontend Developer,"docker, kubernetes, pandas",Coursera,Deep Learning Specialization
Frontend Developer,"mongodb, machine learning, pandas",LinkedIn Learning,MongoDB for Beginners
Backend Developer,"javascript, deep learning",edX,Deep Learning Specialization
Machine Learning Engineer,"kubernetes, css",Udemy,Flutter App Development
Mobile App Developer,"html, flask",Coursera,HTML5 and CSS3 Fundamentals
Full Stack Developer,"tensorflow, mongodb, sql",LinkedIn Learning,Natural Language Processing with Python
DevOps Engineer,"flutter, flask",Coursera,Node.js Backend Development
DevOps Engineer,"pandas, aws",Udemy,C++ Data Structures and Algorithms
DevOps Engineer,"mongodb, docker, javascript, kubernetes",Udemy,Java Programming Masterclass
Frontend Developer,"node.js, kubernetes, django",Coursera,SQL for Data Analysis
Mobile App Developer,"sql, docker, kubernetes, python, nlp",LinkedIn Learning,Node.js Backend Development
Mobile App Developer,"machine learning, css, react, node.js, mongodb",LinkedIn Learning,Flutter App Development
Full Stack Developer,"machine learning, node.js, c++",Coursera,Modern JavaScript Techniques
DevOps Engineer,"aws, deep learning",Coursera,SQL for Data Analysis
AI Engineer,"nlp, swift, css, pandas, machine learning",edX,Flutter App Development
Backend Developer,"flask, react",Pluralsight,TensorFlow Deep Learning
Mobile App Developer,"mongodb, django, tensorflow, python, deep learning",edX,Java Programming Masterclass
Full Stack Developer,"flutter, swift, sql, node.js",LinkedIn Learning,Java Programming Masterclass
Machine Learning Engineer,"machine learning, java, sql, aws",Pluralsight,Java Programming Masterclass
Frontend Developer,"aws, java, nlp",Pluralsight,Natural Language Processing with Python
DevOps Engineer,"nlp, c++, mongodb, sql, react",Pluralsight,SQL for Data Analysis
AI Engineer,"flask, node.js",LinkedIn Learning,Java Programming Masterclass
Machine Learning Engineer,"django, javascript, flask, html, css",Coursera,HTML5 and CSS3 Fundamentals
Full Stack Developer,"c++, aws, swift, flask, deep learning",Udemy,Django Web Development
DevOps Engineer,"tensorflow, javascript",Coursera,Django Web Development
Data Scientist,"kubernetes, machine learning, mongodb, flask, css",edX,TensorFlow Deep Learning
DevOps Engineer,"flask, pandas, java, kubernetes",edX,Data Analysis with Pandas
Backend Developer,"c++, kubernetes, python, flask, aws",Udemy,Java Programming Masterclass
Mobile App Developer,"kubernetes, java, swift, machine learning, flask",Udemy,Python for Data Science
Backend Developer,"aws, sql",Coursera,Flutter App Development
DevOps Engineer,"flutter, docker, html",Coursera,Kubernetes for Developers
Frontend Developer,"flutter, mongodb",Udemy,Python for Data Science
DevOps Engineer,"django, swift, css",Coursera,Docker Essentials
Backend Developer,"python, c++, pandas",edX,C++ Data Structures and Algorithms
DevOps Engineer,"flask, node.js",Coursera,Java Programming Masterclass
Frontend Developer,"pandas, flask",Coursera,Deep Learning Specialization
Data Scientist,"c++, machine learning",Pluralsight,Modern JavaScript Techniques
Mobile App Developer,"django, sql",LinkedIn Learning,AWS Certified Solutions Architect
AI Engineer,"javascript, docker, tensorflow",edX,Machine Learning with Python
DevOps Engineer,"flask, java, nlp, node.js, tensorflow",Pluralsight,MongoDB for Beginners
Full Stack Developer,"pandas, javascript, css, deep learning",Udemy,Swift Programming for iOS
Machine Learning Engineer,"css, react, flask, aws, kubernetes",Coursera,React Advanced Concepts
Full Stack Developer,"c++, django, html, swift, sql",Udemy,SQL for Data Analysis
Full Stack Developer,"html, tensorflow, swift",Udemy,Flutter App Development
Full Stack Developer,"react, pandas, javascript, sql",LinkedIn Learning,Data Analysis with Pandas
Mobile App Developer,"node.js, flutter, css, c++, html",edX,React Advanced Concepts
DevOps Engineer,"sql, swift, react, mongodb",Udemy,Docker Essentials
Backend Developer,"machine learning, java, html, flutter, aws",Coursera,Machine Learning with Python
Full Stack Developer,"html, docker, kubernetes",edX,HTML5 and CSS3 Fundamentals
Machine Learning Engineer,"django, docker, css",Coursera,Flutter App Development
AI Engineer,"sql, react, swift",Udemy,MongoDB for Beginners
AI Engineer,"machine learning, html, swift, react",LinkedIn Learning,Flutter App Development
DevOps Engineer,"java, c++, aws",Pluralsight,Data Analysis with Pandas
AI Engineer,"sql, java",edX,React Advanced Concepts
Data Scientist,"pandas, mongodb, node.js",edX,SQL for Data Analysis
Backend Developer,"machine learning, flask, kubernetes, mongodb, nlp",Pluralsight,Flask for Web Applications
AI Engineer,"css, aws, html, sql",Pluralsight,Java Programming Masterclass
Frontend Developer,"docker, flask",Pluralsight,Kubernetes for Developers
Mobile App Developer,"pandas, flutter",LinkedIn Learning,TensorFlow Deep Learning
DevOps Engineer,"html, tensorflow, pandas, mongodb",Udemy,Docker Essentials
DevOps Engineer,"deep learning, nlp, aws, c++, kubernetes",Udemy,Docker Essentials
DevOps Engineer,"swift, docker, node.js, kubernetes",Coursera,Kubernetes for Developers
Backend Developer,"react, swift, sql",Coursera,Data Analysis with Pandas
Machine Learning Engineer,"css, node.js, sql, aws, nlp",edX,HTML5 and CSS3 Fundamentals
Backend Developer,"deep learning, java, aws",Coursera,Django Web Development
Frontend Developer,"swift, javascript, react, flask",Pluralsight,SQL for Data Analysis
AI Engineer,"flutter, swift, pandas, tensorflow",LinkedIn Learning,Docker Essentials
Mobile App Developer,"flutter, java, node.js, deep learning, tensorflow",Pluralsight,Django Web Development
Full Stack Developer,"css, html, flask, c++, node.js",Udemy,Flask for Web Applications
Full Stack Developer,"django, java, html, kubernetes, react",Coursera,Modern JavaScript Techniques
Mobile App Developer,"deep learning, javascript, django, java, css",Pluralsight,TensorFlow Deep Learning
Frontend Developer,"mongodb, java, flask, react, aws",Coursera,AWS Certified Solutions Architect
Full Stack Developer,"nlp, tensorflow",Pluralsight,C++ Data Structures and Algorithms
Data Scientist,"javascript, html, react, aws",Pluralsight,AWS Certified Solutions Architect
DevOps Engineer,"flask, java, css, aws, docker",LinkedIn Learning,HTML5 and CSS3 Fundamentals
Full Stack Developer,"django, css, kubernetes, deep learning",Udemy,Flask for Web Applications
Full Stack Developer,"javascript, pandas, deep learning, tensorflow",Udemy,Java Programming Masterclass
DevOps Engineer,"flutter, nlp, aws",Pluralsight,Deep Learning Specialization
Mobile App Developer,"nlp, django",LinkedIn Learning,React Advanced Concepts
Backend Developer,"swift, html",edX,MongoDB for Beginners
Mobile App Developer,"nlp, machine learning",Udemy,Python for Data Science
Backend Developer,"css, react, tensorflow, aws, pandas",LinkedIn Learning,Java Programming Masterclass
Full Stack Developer,"c++, docker, python, java",LinkedIn Learning,Node.js Backend Development
Frontend Developer,"docker, swift, node.js",Coursera,Modern JavaScript Techniques
Data Scientist,"mongodb, deep learning, java, html",LinkedIn Learning,Node.js Backend Development
Data Scientist,"flask, swift, nlp, aws",LinkedIn Learning,C++ Data Structures and Algorithms
AI Engineer,"kubernetes, pandas",Udemy,Java Programming Masterclass
Mobile App Developer,"mongodb, deep learning, docker",LinkedIn Learning,C++ Data Structures and Algorithms
DevOps Engineer,"swift, flask",Udemy,Java Programming Masterclass
Mobile App Developer,"swift, aws",Pluralsight,Machine Learning with Python
AI Engineer,"kubernetes, docker, javascript",Pluralsight,Python for Data Science
Backend Developer,"react, aws, django",Udemy,Python for Data Science
Backend Developer,"nlp, html, flutter, sql, aws",Coursera,Flask for Web Applications
DevOps Engineer,"node.js, python, flutter, kubernetes, sql",Pluralsight,TensorFlow Deep Learning
DevOps Engineer,"docker, machine learning, node.js, swift",LinkedIn Learning,TensorFlow Deep Learning
Backend Developer,"flask, nlp, swift, java, aws",Coursera,Modern JavaScript Techniques
Frontend Developer,"nlp, node.js, docker, javascript, python",Udemy,Django Web Development
Machine Learning Engineer,"docker, java, mongodb, sql",Udemy,Python for Data Science
DevOps Engineer,"css, c++",LinkedIn Learning,Modern JavaScript Techniques
Full Stack Developer,"kubernetes, python, machine learning, tensorflow",Pluralsight,AWS Certified Solutions Architect
AI Engineer,"java, tensorflow",Pluralsight,React Advanced Concepts
Backend Developer,"machine learning, aws, docker, node.js",Udemy,Java Programming Masterclass
Machine Learning Engineer,"flask, sql, docker",LinkedIn Learning,Data Analysis with Pandas
Backend Developer,"react, swift, nlp, css",edX,Docker Essentials
Backend Developer,"nlp, html, flask, sql",edX,Data Analysis with Pandas
Full Stack Developer,"django, mongodb",edX,Node.js Backend Development
Machine Learning Engineer,"flask, swift, aws",Coursera,AWS Certified Solutions Architect
Frontend Developer,"html, aws, css",Coursera,HTML5 and CSS3 Fundamentals
DevOps Engineer,"pandas, mongodb, java, c++",LinkedIn Learning,AWS Certified Solutions Architect
Frontend Developer,"html, kubernetes, flask, django, c++",Coursera,C++ Data Structures and Algorithms
Backend Developer,"html, sql, machine learning",LinkedIn Learning,MongoDB for Beginners
Data Scientist,"kubernetes, c++, flask, pandas",edX,Flask for Web Applications
AI Engineer,"docker, sql, kubernetes, tensorflow, python",Coursera,Python for Data Science
Frontend Developer,"java, deep learning, sql",Udemy,Deep Learning Specialization
DevOps Engineer,"css, aws, java, kubernetes, mongodb",edX,Data Analysis with Pandas
Machine Learning Engineer,"flask, javascript",Pluralsight,Python for Data Science
Full Stack Developer,"deep learning, flutter, css, sql",edX,TensorFlow Deep Learning
Full Stack Developer,"tensorflow, sql, django",Coursera,Modern JavaScript Techniques
Mobile App Developer,"tensorflow, docker, css, machine learning, swift",Coursera,Docker Essentials
Backend Developer,"c++, react, kubernetes, tensorflow, java",Coursera,Flask for Web Applications
Full Stack Developer,"docker, java",Pluralsight,Machine Learning with Python
Frontend Developer,"c++, python",LinkedIn Learning,MongoDB for Beginners
Frontend Developer,"react, node.js, html",Coursera,Machine Learning with Python
Backend Developer,"c++, pandas",Coursera,Flutter App Development
Frontend Developer,"tensorflow, nlp, aws",Pluralsight,Flask for Web Applications
Backend Developer,"nlp, tensorflow, react, python, pandas",Coursera,React Advanced Concepts
AI Engineer,"css, node.js, django, swift",edX,Flask for Web Applications
Mobile App Developer,"javascript, flask, pandas",LinkedIn Learning,TensorFlow Deep Learning
Data Scientist,"python, react, django, machine learning",Pluralsight,Swift Programming for iOS
Full Stack Developer,"aws, sql, pandas, python",Coursera,AWS Certified Solutions Architect
Frontend Developer,"html, javascript, c++",Coursera,Python for Data Science
Full Stack Developer,"c++, python, html, deep learning",Pluralsight,Node.js Backend Development
Backend Developer,"swift, deep learning, sql",edX,HTML5 and CSS3 Fundamentals
Full Stack Developer,"swift, sql, javascript",Udemy,Swift Programming for iOS
AI Engineer,"machine learning, python, java, mongodb, react",edX,Flutter App Development
Data Scientist,"docker, node.js",Pluralsight,Flutter App Development
DevOps Engineer,"kubernetes, deep learning, aws",LinkedIn Learning,HTML5 and CSS3 Fundamentals
AI Engineer,"node.js, css",Coursera,Node.js Backend Development
AI Engineer,"javascript, node.js, kubernetes, deep learning, python",LinkedIn Learning,Django Web Development
Frontend Developer,"docker, machine learning, deep learning, sql",Pluralsight,Data Analysis with Pandas
AI Engineer,"machine learning, nlp, pandas, css, tensorflow",Udemy,Deep Learning Specialization
AI Engineer,"pandas, flask",Coursera,Flutter App Development
Mobile App Developer,"react, kubernetes, swift, flask",Pluralsight,React Advanced Concepts
AI Engineer,"swift, python, node.js",LinkedIn Learning,Data Analysis with Pandas
Backend Developer,"docker, tensorflow",Pluralsight,HTML5 and CSS3 Fundamentals
Machine Learning Engineer,"aws, java, html, docker",LinkedIn Learning,Java Programming Masterclass
Full Stack Developer,"flutter, html, python",Pluralsight,SQL for Data Analysis
Mobile App Developer,"tensorflow, docker",Coursera,Java Programming Masterclass
DevOps Engineer,"python, nlp, swift, c++, javascript",LinkedIn Learning,Modern JavaScript Techniques
Backend Developer,"java, docker, pandas, tensorflow, flutter",Udemy,React Advanced Concepts
Machine Learning Engineer,"django, c++, node.js",Pluralsight,MongoDB for Beginners
Frontend Developer,"flask, docker, node.js, mongodb",LinkedIn Learning,Flask for Web Applications
Backend Developer,"javascript, machine learning, sql, kubernetes, swift",Coursera,C++ Data Structures and Algorithms
DevOps Engineer,"sql, flutter, react",edX,Data Analysis with Pandas
Frontend Developer,"mongodb, css, machine learning, nlp",Coursera,TensorFlow Deep Learning
Backend Developer,"swift, html, node.js",LinkedIn Learning,Docker Essentials
DevOps Engineer,"node.js, swift, mongodb, css, c++",LinkedIn Learning,TensorFlow Deep Learning
Mobile App Developer,"java, tensorflow, javascript, css, sql",Udemy,Node.js Backend Development
Mobile App Developer,"java, pandas, flutter",edX,TensorFlow Deep Learning
Machine Learning Engineer,"node.js, html, machine learning",LinkedIn Learning,Java Programming Masterclass
Data Scientist,"flask, swift",edX,Java Programming Masterclass
Machine Learning Engineer,"flutter, nlp",LinkedIn Learning,Modern JavaScript Techniques
Machine Learning Engineer,"kubernetes, tensorflow, c++, pandas, deep learning",Udemy,Kubernetes for Developers
Data Scientist,"aws, mongodb, docker, html",Pluralsight,Kubernetes for Developers
Mobile App Developer,"deep learning, swift, html, aws",LinkedIn Learning,C++ Data Structures and Algorithms
Mobile App Developer,"react, aws",Coursera,Python for Data Science
AI Engineer,"css, nlp, html",Udemy,Docker Essentials
DevOps Engineer,"sql, react, c++, flutter, swift",Pluralsight,AWS Certified Solutions Architect
Machine Learning Engineer,"deep learning, pandas, kubernetes, java",edX,Data Analysis with Pandas
AI Engineer,"nlp, node.js, python, kubernetes",Pluralsight,Node.js Backend Development
DevOps Engineer,"sql, deep learning, html",Coursera,Flutter App Development
Mobile App Developer,"css, deep learning",Pluralsight,Swift Programming for iOS
Full Stack Developer,"flutter, javascript, python, docker",LinkedIn Learning,Java Programming Masterclass
DevOps Engineer,"aws, django, sql, flask",Udemy,MongoDB for Beginners
Data Scientist,"aws, sql, nlp, kubernetes, swift",Coursera,AWS Certified Solutions Architect
DevOps Engineer,"deep learning, flask, sql",Coursera,AWS Certified Solutions Architect
Mobile App Developer,"python, node.js, django, kubernetes",edX,Natural Language Processing with Python
Mobile App Developer,"tensorflow, deep learning, c++, flask",Udemy,Data Analysis with Pandas
Mobile App Developer,"node.js, css",Pluralsight,SQL for Data Analysis
Mobile App Developer,"html, deep learning, docker, c++, machine learning",LinkedIn Learning,Docker Essentials
Data Scientist,"docker, nlp, swift, deep learning, css",LinkedIn Learning,Swift Programming for iOS
Data Scientist,"nlp, django, node.js, flask",edX,Machine Learning with Python
Machine Learning Engineer,"python, swift, node.js, pandas, c++",Udemy,Java Programming Masterclass
Full Stack Developer,"machine learning, pandas, css, node.js",Coursera,Node.js Backend Development
Mobile App Developer,"sql, tensorflow",edX,SQL for Data Analysis
Mobile App Developer,"pandas, c++, flutter, swift, javascript",LinkedIn Learning,Kubernetes for Developers
DevOps Engineer,"c++, nlp, javascript, swift",LinkedIn Learning,AWS Certified Solutions Architect
Mobile App Developer,"javascript, flutter",LinkedIn Learning,MongoDB for Beginners
Frontend Developer,"java, docker",LinkedIn Learning,Deep Learning Specialization
Mobile App Developer,"sql, html",edX,Flutter App Development
Data Scientist,"django, swift, machine learning, java",Udemy,React Advanced Concepts
AI Engineer,"html, django",Udemy,SQL for Data Analysis
DevOps Engineer,"nlp, django, flutter, swift",Coursera,Deep Learning Specialization
Backend Developer,"javascript, node.js",Udemy,TensorFlow Deep Learning
Frontend Developer,"javascript, nlp",LinkedIn Learning,Node.js Backend Development
DevOps Engineer,"mongodb, c++, flutter, tensorflow, flask",Pluralsight,Swift Programming for iOS
Full Stack Developer,"flutter, python",edX,Flask for Web Applications
Machine Learning Engineer,"django, css, flask",Udemy,Data Analysis with Pandas
Backend Developer,"css, sql, react, html",Pluralsight,Natural Language Processing with Python
DevOps Engineer,"aws, java",Pluralsight,Java Programming Masterclass
Full Stack Developer,"aws, python, sql, css",edX,React Advanced Concepts
AI Engineer,"html, c++, react, pandas, nlp",Coursera,Flask for Web Applications
AI Engineer,"java, nlp, machine learning, django",Udemy,Docker Essentials
Full Stack Developer,"c++, css",edX,TensorFlow Deep Learning
Mobile App Developer,"flask, mongodb, c++",LinkedIn Learning,C++ Data Structures and Algorithms
Mobile App Developer,"deep learning, java, aws",Udemy,Flutter App Development
Frontend Developer,"nlp, pandas, aws",edX,HTML5 and CSS3 Fundamentals
Data Scientist,"flask, aws",Coursera,SQL for Data Analysis
Frontend Developer,"java, mongodb",Udemy,Modern JavaScript Techniques
Full Stack Developer,"nlp, swift, html, mongodb",Pluralsight,Machine Learning with Python
Frontend Developer,"c++, nlp, aws, javascript",Coursera,SQL for Data Analysis
Data Scientist,"html, pandas, docker, python",Udemy,Java Programming Masterclass
Data Scientist,"html, react",Udemy,Java Programming Masterclass
Mobile App Developer,"tensorflow, html, docker, python, c++",Coursera,Modern JavaScript Techniques
Backend Developer,"machine learning, mongodb, c++, node.js",LinkedIn Learning,AWS Certified Solutions Architect
DevOps Engineer,"kubernetes, css, c++, react",LinkedIn Learning,Data Analysis with Pandas
Backend Developer,"nlp, c++, flask, mongodb, python",edX,Swift Programming for iOS
Frontend Developer,"flask, docker, python, kubernetes",LinkedIn Learning,Flask for Web Applications
DevOps Engineer,"javascript, html, python",LinkedIn Learning,Deep Learning Specialization
DevOps Engineer,"flutter, node.js",edX,Machine Learning with Python
DevOps Engineer,"java, pandas, python, node.js",LinkedIn Learning,Node.js Backend Development
Data Scientist,"sql, swift, java, aws",Udemy,Flask for Web Applications
Machine Learning Engineer,"node.js, c++, nlp",edX,Java Programming Masterclass
Full Stack Developer,"tensorflow, docker",edX,MongoDB for Beginners
Machine Learning Engineer,"flutter, swift, java, javascript, react",edX,React Advanced Concepts
Machine Learning Engineer,"deep learning, python, node.js, flask",Udemy,Swift Programming for iOS
Backend Developer,"docker, flask, kubernetes",Pluralsight,MongoDB for Beginners
Machine Learning Engineer,"javascript, flask, react, python, docker",Udemy,Flask for Web Applications
DevOps Engineer,"pandas, flask",edX,Java Programming Masterclass
DevOps Engineer,"swift, nlp",Udemy,Flask for Web Applications
AI Engineer,"aws, docker",Udemy,Kubernetes for Developers
Backend Developer,"python, html",edX,Flutter App Development
Backend Developer,"swift, flutter, java, css",edX,Node.js Backend Development
Machine Learning Engineer,"django, javascript, deep learning, kubernetes",Udemy,Python for Data Science
Backend Developer,"node.js, pandas, html, aws, sql",Udemy,SQL for Data Analysis
Full Stack Developer,"flutter, react",Udemy,Flask for Web Applications
Data Scientist,"java, javascript, sql",Coursera,Flask for Web Applications
DevOps Engineer,"docker, flask",LinkedIn Learning,Kubernetes for Developers
DevOps Engineer,"react, docker, c++",LinkedIn Learning,Flutter App Development
Full Stack Developer,"mongodb, deep learning, tensorflow",edX,AWS Certified Solutions Architect
Machine Learning Engineer,"c++, flask, tensorflow",Coursera,Flask for Web Applications
Mobile App Developer,"django, flask, swift",Udemy,Swift Programming for iOS
Mobile App Developer,"pandas, javascript, kubernetes",LinkedIn Learning,Docker Essentials
AI Engineer,"pandas, c++, deep learning, css",edX,HTML5 and CSS3 Fundamentals
Frontend Developer,"docker, nlp, mongodb, swift, kubernetes",Udemy,Natural Language Processing with Python
Data Scientist,"pandas, javascript",Pluralsight,Data Analysis with Pandas
Backend Developer,"django, javascript, python, deep learning, flask",edX,SQL for Data Analysis
AI Engineer,"react, machine learning",Udemy,SQL for Data Analysis
Mobile App Developer,"css, django",Udemy,TensorFlow Deep Learning
Full Stack Developer,"react, java",Pluralsight,Python for Data Science
Machine Learning Engineer,"flutter, django, node.js",edX,TensorFlow Deep Learning
Machine Learning Engineer,"flask, python, docker, kubernetes, javascript",LinkedIn Learning,AWS Certified Solutions Architect
Data Scientist,"java, javascript, sql, aws, docker",Coursera,TensorFlow Deep Learning
