Job Title,Known Skills,Platform,Course Title
Full Stack Developer,"deep learning, tensorflow, machine learning",Coursera,Python for Data Science
Data Scientist,"flask, java, tensorflow",LinkedIn Learning,Flutter App Development
Machine Learning Engineer,"pandas, tensorflow",edX,Natural Language Processing with Python
Full Stack Developer,"mongodb, django, flutter, deep learning, javascript",Pluralsight,Modern JavaScript Techniques
DevOps Engineer,"swift, c++",Pluralsight,Python for Data Science
Mobile App Developer,"docker, css, javascript, swift, mongodb",Coursera,C++ Data Structures and Algorithms
Data Scientist,"flutter, react",edX,Django Web Development
Machine Learning Engineer,"kubernetes, flask, node.js, css",Coursera,Deep Learning Specialization
Full Stack Developer,"flutter, machine learning",Pluralsight,Node.js Backend Development
Mobile App Developer,"mongodb, swift, django, node.js, react",Pluralsight,Data Analysis with Pandas
Backend Developer,"aws, javascript, react, mongodb",edX,Node.js Backend Development
Mobile App Developer,"swift, c++, nlp",Pluralsight,Natural Language Processing with Python
Data Scientist,"html, node.js, c++, javascript, python",Pluralsight,Kubernetes for Developers
Machine Learning Engineer,"css, docker, flutter, django, nlp",Udemy,C++ Data Structures and Algorithms
Machine Learning Engineer,"flutter, html, mongodb, tensorflow",Pluralsight,Swift Programming for iOS
Data Scientist,"javascript, mongodb, docker, kubernetes",LinkedIn Learning,AWS Certified Solutions Architect
DevOps Engineer,"node.js, django",Coursera,Flutter App Development
Machine Learning Engineer,"nlp, django",Udemy,C++ Data Structures and Algorithms
Machine Learning Engineer,"deep learning, flask, html, mongodb, django",Pluralsight,Flutter App Development
Full Stack Developer,"django, sql",Pluralsight,SQL for Data Analysis
DevOps Engineer,"nlp, flask, swift",LinkedIn Learning,Deep Learning Specialization
Frontend Developer,"sql, django, java",LinkedIn Learning,Data Analysis with Pandas
Mobile App Developer,"sql, docker",edX,Machine Learning with Python
AI Engineer,"css, java, flask",Udemy,Java Programming Masterclass
Backend Developer,"c++, django, python",Coursera,Kubernetes for Developers
DevOps Engineer,"nlp, react, javascript",Coursera,Machine Learning with Python
Frontend Developer,"kubernetes, python, django, nlp, css",edX,Java Programming Masterclass
Machine Learning Engineer,"node.js, react, sql, javascript, python",edX,Kubernetes for Developers
Backend Developer,"docker, flutter, swift, css",Udemy,HTML5 and CSS3 Fundamentals
Mobile App Developer,"machine learning, sql, python",Udemy,Modern JavaScript Techniques
Data Scientist,"flask, tensorflow, c++",edX,Node.js Backend Development
Frontend Developer,"flutter, html, swift",edX,React Advanced Concepts
Machine Learning Engineer,"css, django",Pluralsight,Docker Essentials
Data Scientist,"swift, python, pandas",Coursera,Natural Language Processing with Python
Data Scientist,"java, nlp, mongodb, javascript",Udemy,Flutter App Development
Frontend Developer,"machine learning, django, mongodb, sql",Coursera,C++ Data Structures and Algorithms
AI Engineer,"sql, pandas",edX,Java Programming Masterclass
Data Scientist,"kubernetes, django",edX,AWS Certified Solutions Architect
Mobile App Developer,"html, c++, node.js",edX,Node.js Backend Development
Backend Developer,"aws, c++, django, react",Udemy,Natural Language Processing with Python
Mobile App Developer,"flask, pandas, flutter, swift, mongodb",LinkedIn Learning,Swift Programming for iOS
Backend Developer,"html, docker, swift, mongodb, machine learning",Coursera,TensorFlow Deep Learning
Backend Developer,"tensorflow, swift, django, deep learning, docker",Coursera,SQL for Data Analysis
Machine Learning Engineer,"mongodb, css, react",Coursera,Docker Essentials
Mobile App Developer,"swift, sql, tensorflow",Pluralsight,Deep Learning Specialization
AI Engineer,"nlp, mongodb",LinkedIn Learning,React Advanced Concepts
AI Engineer,"css, flask, sql, html",Udemy,Flutter App Development
Backend Developer,"pandas, html, python, c++",Udemy,Swift Programming for iOS
Backend Developer,"flutter, java, c++",Coursera,Modern JavaScript Techniques
Mobile App Developer,"machine learning, sql, deep learning, javascript, mongodb",Coursera,Docker Essentials
Full Stack Developer,"javascript, kubernetes, swift",Coursera,Django Web Development
Frontend Developer,"java, css",Pluralsight,Django Web Development
Data Scientist,"sql, nlp, deep learning, django",LinkedIn Learning,Machine Learning with Python
Mobile App Developer,"kubernetes, python, tensorflow",Udemy,Django Web Development
Backend Developer,"mongodb, sql, flask",LinkedIn Learning,Docker Essentials
Mobile App Developer,"javascript, pandas",Pluralsight,C++ Data Structures and Algorithms
DevOps Engineer,"pandas, kubernetes, machine learning, flask",Pluralsight,Java Programming Masterclass
DevOps Engineer,"kubernetes, node.js, mongodb, python, aws",edX,Modern JavaScript Techniques
Backend Developer,"machine learning, pandas, kubernetes",LinkedIn Learning,Natural Language Processing with Python
Backend Developer,"html, react, deep learning, flutter",LinkedIn Learning,Swift Programming for iOS
Mobile App Developer,"kubernetes, nlp, java",edX,Machine Learning with Python
Backend Developer,"django, flutter",LinkedIn Learning,Kubernetes for Developers
Full Stack Developer,"html, javascript, css, mongodb",Pluralsight,Data Analysis with Pandas
Backend Developer,"react, java",Pluralsight,HTML5 and CSS3 Fundamentals
Backend Developer,"mongodb, flask, java, sql, pandas",Pluralsight,React Advanced Concepts
AI Engineer,"html, docker, machine learning",Udemy,SQL for Data Analysis
Backend Developer,"flask, java, nlp",Coursera,Node.js Backend Development
Mobile App Developer,"flask, java, c++, deep learning, machine learning",Pluralsight,SQL for Data Analysis
Mobile App Developer,"flutter, python, kubernetes",Pluralsight,Node.js Backend Development
AI Engineer,"css, python",Udemy,TensorFlow Deep Learning
DevOps Engineer,"node.js, html, javascript, tensorflow",Coursera,MongoDB for Beginners
Backend Developer,"django, javascript, pandas",Pluralsight,Java Programming Masterclass
Data Scientist,"java, mongodb, docker, nlp",Udemy,MongoDB for Beginners
DevOps Engineer,"javascript, nlp, swift, react, mongodb",LinkedIn Learning,C++ Data Structures and Algorithms
Machine Learning Engineer,"docker, css, flutter, aws, c++",Udemy,AWS Certified Solutions Architect
AI Engineer,"css, deep learning, flutter, flask",Pluralsight,Java Programming Masterclass
Backend Developer,"flask, nlp, machine learning, javascript, mongodb",Coursera,Flask for Web Applications
Mobile App Developer,"mongodb, swift, flask, kubernetes",Udemy,Deep Learning Specialization
Full Stack Developer,"css, deep learning, nlp, javascript",Udemy,Deep Learning Specialization
Frontend Developer,"flask, html, sql",edX,Java Programming Masterclass
Machine Learning Engineer,"react, machine learning, mongodb, python, pandas",LinkedIn Learning,Django Web Development
Full Stack Developer,"deep learning, python",LinkedIn Learning,Flutter App Development
DevOps Engineer,"swift, java, aws, node.js",Udemy,Node.js Backend Development
Data Scientist,"node.js, flutter, react, javascript",Coursera,C++ Data Structures and Algorithms
AI Engineer,"deep learning, css",Coursera,C++ Data Structures and Algorithms
Full Stack Developer,"css, docker",Coursera,C++ Data Structures and Algorithms
Frontend Developer,"django, tensorflow",Udemy,SQL for Data Analysis
AI Engineer,"machine learning, java, css, docker",LinkedIn Learning,C++ Data Structures and Algorithms
Frontend Developer,"flutter, aws, sql",edX,React Advanced Concepts
Data Scientist,"swift, pandas, javascript, react",LinkedIn Learning,Python for Data Science
Data Scientist,"node.js, tensorflow, flutter, django",Coursera,SQL for Data Analysis
Data Scientist,"docker, react, sql, mongodb",Coursera,C++ Data Structures and Algorithms
DevOps Engineer,"sql, docker",LinkedIn Learning,Kubernetes for Developers
Data Scientist,"deep learning, react",Pluralsight,React Advanced Concepts
Machine Learning Engineer,"flutter, c++, nlp",Udemy,Python for Data Science
Data Scientist,"tensorflow, flask, django, python",Coursera,Python for Data Science
Backend Developer,"flask, html",edX,Java Programming Masterclass
Frontend Developer,"swift, docker, aws, deep learning",Udemy,SQL for Data Analysis
AI Engineer,"docker, flask, tensorflow, kubernetes, java",Pluralsight,Python for Data Science
Backend Developer,"java, swift, c++",edX,Deep Learning Specialization
Mobile App Developer,"nlp, react",edX,Kubernetes for Developers
Backend Developer,"tensorflow, aws, mongodb",edX,HTML5 and CSS3 Fundamentals
Mobile App Developer,"sql, pandas",Pluralsight,Deep Learning Specialization
Frontend Developer,"deep learning, node.js, machine learning, pandas",Udemy,Machine Learning with Python
DevOps Engineer,"c++, node.js, pandas, swift",Coursera,Swift Programming for iOS
Data Scientist,"c++, swift, python, tensorflow",Pluralsight,TensorFlow Deep Learning
Full Stack Developer,"c++, css, aws, node.js, django",LinkedIn Learning,SQL for Data Analysis
AI Engineer,"flutter, c++, sql, react, javascript",Udemy,HTML5 and CSS3 Fundamentals
Full Stack Developer,"pandas, swift, tensorflow, html, machine learning",Udemy,Django Web Development
DevOps Engineer,"javascript, html, node.js",LinkedIn Learning,AWS Certified Solutions Architect
Data Scientist,"react, tensorflow, sql, django, java",Coursera,Docker Essentials
Mobile App Developer,"flask, java",Pluralsight,TensorFlow Deep Learning
Frontend Developer,"swift, machine learning, django",Udemy,Data Analysis with Pandas
Frontend Developer,"node.js, django, nlp, css",Pluralsight,C++ Data Structures and Algorithms
AI Engineer,"swift, java, node.js, mongodb",Coursera,C++ Data Structures and Algorithms
Frontend Developer,"css, aws, node.js, tensorflow",LinkedIn Learning,Django Web Development
Mobile App Developer,"pandas, django, sql, c++, node.js",Pluralsight,Modern JavaScript Techniques
Mobile App Developer,"pandas, javascript, machine learning, tensorflow, sql",Udemy,Modern JavaScript Techniques
DevOps Engineer,"java, machine learning, nlp, c++, flask",Coursera,Swift Programming for iOS
Frontend Developer,"nlp, tensorflow, c++",Udemy,C++ Data Structures and Algorithms
Machine Learning Engineer,"html, machine learning, css, javascript, python",edX,Deep Learning Specialization
Mobile App Developer,"javascript, react, pandas, machine learning",Pluralsight,Modern JavaScript Techniques
Machine Learning Engineer,"html, kubernetes, react, deep learning, css",edX,Kubernetes for Developers
Machine Learning Engineer,"react, machine learning, javascript, deep learning, node.js",Pluralsight,Node.js Backend Development
Full Stack Developer,"sql, django",Coursera,Java Programming Masterclass
Backend Developer,"aws, kubernetes, deep learning, c++",Udemy,Kubernetes for Developers
Full Stack Developer,"machine learning, nlp, c++, javascript",edX,Flask for Web Applications
Backend Developer,"kubernetes, mongodb, javascript, java, html",LinkedIn Learning,Deep Learning Specialization
Mobile App Developer,"nlp, deep learning, java",Udemy,Kubernetes for Developers
AI Engineer,"mongodb, tensorflow, node.js, c++, nlp",LinkedIn Learning,Flask for Web Applications
Backend Developer,"kubernetes, machine learning, tensorflow, javascript",LinkedIn Learning,AWS Certified Solutions Architect
Mobile App Developer,"nlp, swift, django, mongodb, css",Pluralsight,TensorFlow Deep Learning
Machine Learning Engineer,"html, react",Pluralsight,Data Analysis with Pandas
Data Scientist,"swift, deep learning",Udemy,Django Web Development
Machine Learning Engineer,"mongodb, python, pandas, swift",LinkedIn Learning,Deep Learning Specialization
Backend Developer,"sql, django",Pluralsight,HTML5 and CSS3 Fundamentals
Frontend Developer,"django, flask, tensorflow, machine learning, node.js",edX,Flask for Web Applications
Machine Learning Engineer,"swift, sql, mongodb, pandas",LinkedIn Learning,Kubernetes for Developers
Mobile App Developer,"django, flask, mongodb, html, node.js",Udemy,SQL for Data Analysis
Machine Learning Engineer,"react, kubernetes, sql, node.js",Pluralsight,Docker Essentials
Frontend Developer,"node.js, kubernetes, deep learning",Pluralsight,React Advanced Concepts
Data Scientist,"javascript, node.js, deep learning, kubernetes, java",LinkedIn Learning,Natural Language Processing with Python
Full Stack Developer,"flask, docker, html",Coursera,Java Programming Masterclass
Frontend Developer,"tensorflow, sql, node.js",LinkedIn Learning,TensorFlow Deep Learning
Data Scientist,"tensorflow, java, css, sql, python",Coursera,HTML5 and CSS3 Fundamentals
Mobile App Developer,"aws, javascript, swift",Coursera,Swift Programming for iOS
Full Stack Developer,"css, python",LinkedIn Learning,Java Programming Masterclass
Backend Developer,"node.js, flutter, sql, django, mongodb",Udemy,Django Web Development
Mobile App Developer,"mongodb, kubernetes, css",Udemy,C++ Data Structures and Algorithms
Frontend Developer,"kubernetes, swift, flutter",edX,SQL for Data Analysis
AI Engineer,"python, javascript",Coursera,Java Programming Masterclass
Frontend Developer,"kubernetes, aws, c++, machine learning",LinkedIn Learning,Kubernetes for Developers
Data Scientist,"nlp, react",Udemy,Kubernetes for Developers
Backend Developer,"aws, javascript",LinkedIn Learning,AWS Certified Solutions Architect
Full Stack Developer,"sql, django, docker, c++, deep learning",LinkedIn Learning,Docker Essentials
AI Engineer,"swift, pandas, aws, kubernetes",edX,Machine Learning with Python
Mobile App Developer,"pandas, c++",Udemy,Swift Programming for iOS
Machine Learning Engineer,"javascript, flutter, sql",LinkedIn Learning,MongoDB for Beginners
AI Engineer,"html, flutter, deep learning, java, css",Coursera,TensorFlow Deep Learning
AI Engineer,"java, html, mongodb, c++, deep learning",Coursera,React Advanced Concepts
Full Stack Developer,"react, swift, docker, deep learning",Coursera,Flask for Web Applications
Frontend Developer,"javascript, deep learning, nlp, machine learning, docker",edX,SQL for Data Analysis
Machine Learning Engineer,"c++, mongodb",Pluralsight,React Advanced Concepts
DevOps Engineer,"swift, node.js, mongodb, machine learning, nlp",Udemy,MongoDB for Beginners
AI Engineer,"c++, kubernetes",edX,Docker Essentials
Backend Developer,"react, docker, nlp, tensorflow, flutter",Udemy,Deep Learning Specialization
DevOps Engineer,"pandas, javascript",edX,Flutter App Development
Backend Developer,"machine learning, sql, html",LinkedIn Learning,Flask for Web Applications
AI Engineer,"c++, java",Pluralsight,Deep Learning Specialization
Data Scientist,"flutter, node.js, deep learning",Pluralsight,Natural Language Processing with Python
Machine Learning Engineer,"pandas, sql, flask",Pluralsight,Django Web Development
AI Engineer,"flask, java, html",LinkedIn Learning,Python for Data Science
AI Engineer,"docker, react, aws, c++",LinkedIn Learning,Flask for Web Applications
Frontend Developer,"mongodb, java, django, c++",LinkedIn Learning,Java Programming Masterclass
Full Stack Developer,"kubernetes, django",edX,Modern JavaScript Techniques
Backend Developer,"python, mongodb, tensorflow, flask, aws",Udemy,Docker Essentials
Machine Learning Engineer,"flutter, machine learning, deep learning",Coursera,Machine Learning with Python
Full Stack Developer,"python, sql, docker, nlp, tensorflow",Coursera,Node.js Backend Development
DevOps Engineer,"javascript, django",Coursera,Docker Essentials
Mobile App Developer,"django, mongodb",edX,MongoDB for Beginners
AI Engineer,"css, flutter, deep learning, java, python",Pluralsight,Django Web Development
Full Stack Developer,"c++, html, node.js",edX,Node.js Backend Development
Data Scientist,"nlp, aws, flask, javascript",edX,SQL for Data Analysis
Mobile App Developer,"django, python",Pluralsight,Deep Learning Specialization
Backend Developer,"mongodb, react, javascript, docker, flutter",Pluralsight,TensorFlow Deep Learning
Backend Developer,"html, flask, nlp, sql, flutter",Coursera,React Advanced Concepts
Frontend Developer,"python, css, tensorflow",Udemy,Swift Programming for iOS
Backend Developer,"c++, swift, javascript",Coursera,Kubernetes for Developers
AI Engineer,"java, flask",edX,Django Web Development
DevOps Engineer,"java, sql",edX,HTML5 and CSS3 Fundamentals
Full Stack Developer,"machine learning, python, mongodb, flask",Coursera,Deep Learning Specialization
AI Engineer,"deep learning, c++, node.js, tensorflow",Coursera,Django Web Development
AI Engineer,"machine learning, pandas, css",Pluralsight,Node.js Backend Development
Frontend Developer,"aws, css, machine learning",LinkedIn Learning,Flask for Web Applications
DevOps Engineer,"deep learning, kubernetes, c++",Coursera,Node.js Backend Development
Data Scientist,"kubernetes, deep learning, machine learning",Udemy,Java Programming Masterclass
Backend Developer,"aws, react, deep learning",edX,Natural Language Processing with Python
Data Scientist,"aws, javascript, node.js, pandas, c++",Pluralsight,Kubernetes for Developers
AI Engineer,"react, deep learning, pandas",edX,React Advanced Concepts
Full Stack Developer,"react, aws, css, pandas",Udemy,MongoDB for Beginners
Data Scientist,"flask, java, machine learning",Udemy,AWS Certified Solutions Architect
DevOps Engineer,"css, swift, javascript, pandas, docker",edX,Node.js Backend Development
DevOps Engineer,"flask, aws, deep learning, css, flutter",Pluralsight,AWS Certified Solutions Architect
Full Stack Developer,"flutter, java, javascript, deep learning, aws",edX,Docker Essentials
Data Scientist,"css, tensorflow",Udemy,Modern JavaScript Techniques
Frontend Developer,"css, flutter",Pluralsight,Flutter App Development
Backend Developer,"node.js, flask",LinkedIn Learning,Django Web Development
AI Engineer,"pandas, css, javascript, node.js",LinkedIn Learning,Flask for Web Applications
Frontend Developer,"html, django, swift",Udemy,C++ Data Structures and Algorithms
DevOps Engineer,"machine learning, html, kubernetes, pandas, deep learning",Pluralsight,Machine Learning with Python
DevOps Engineer,"react, mongodb, css, docker, deep learning",Coursera,Data Analysis with Pandas
Backend Developer,"sql, html",edX,SQL for Data Analysis
Backend Developer,"c++, nlp, python, django",Coursera,C++ Data Structures and Algorithms
Frontend Developer,"node.js, pandas",edX,Modern JavaScript Techniques
Frontend Developer,"machine learning, aws, java, python, django",Coursera,Machine Learning with Python
Machine Learning Engineer,"flask, html, flutter",Pluralsight,React Advanced Concepts
AI Engineer,"machine learning, mongodb, html",LinkedIn Learning,AWS Certified Solutions Architect
Data Scientist,"react, mongodb, html",edX,Docker Essentials
Mobile App Developer,"pandas, docker, deep learning",LinkedIn Learning,HTML5 and CSS3 Fundamentals
Data Scientist,"docker, tensorflow",LinkedIn Learning,Deep Learning Specialization
Full Stack Developer,"django, pandas, flutter, python, docker",Coursera,Natural Language Processing with Python
Full Stack Developer,"html, python",edX,Java Programming Masterclass
AI Engineer,"machine learning, css, swift",edX,Python for Data Science
DevOps Engineer,"python, javascript, pandas",LinkedIn Learning,Java Programming Masterclass
DevOps Engineer,"pandas, flask, css, python, machine learning",Pluralsight,MongoDB for Beginners
DevOps Engineer,"javascript, sql, swift, deep learning",Pluralsight,Deep Learning Specialization
Mobile App Developer,"deep learning, html, java, react, flask",LinkedIn Learning,Machine Learning with Python
Backend Developer,"django, deep learning, kubernetes, flask",Coursera,Python for Data Science
Full Stack Developer,"sql, flutter",Pluralsight,AWS Certified Solutions Architect
Machine Learning Engineer,"kubernetes, swift",Coursera,HTML5 and CSS3 Fundamentals
Mobile App Developer,"flask, kubernetes, aws, flutter, html",edX,HTML5 and CSS3 Fundamentals
Frontend Developer,"tensorflow, pandas, c++, node.js",LinkedIn Learning,React Advanced Concepts
Full Stack Developer,"flask, sql",LinkedIn Learning,Flask for Web Applications
Backend Developer,"javascript, nlp",Udemy,Data Analysis with Pandas
Mobile App Developer,"kubernetes, sql",Udemy,MongoDB for Beginners
Frontend Developer,"java, nlp, sql, html",Udemy,Java Programming Masterclass
Full Stack Developer,"javascript, kubernetes",Udemy,SQL for Data Analysis
Machine Learning Engineer,"django, html, python",Udemy,Flask for Web Applications
Data Scientist,"machine learning, java, flask, aws",edX,React Advanced Concepts
DevOps Engineer,"docker, machine learning, flutter",edX,Flask for Web Applications
Backend Developer,"sql, c++, nlp, flutter, css",Udemy,Deep Learning Specialization
Full Stack Developer,"java, flask, c++, swift",LinkedIn Learning,TensorFlow Deep Learning
Full Stack Developer,"nlp, tensorflow, swift, react",Coursera,Flask for Web Applications
Full Stack Developer,"python, flutter, java, aws, html",Udemy,HTML5 and CSS3 Fundamentals
Mobile App Developer,"docker, javascript, tensorflow",LinkedIn Learning,Kubernetes for Developers
DevOps Engineer,"java, flutter, kubernetes, sql",Coursera,Python for Data Science
AI Engineer,"flask, html, swift",Udemy,Java Programming Masterclass
Full Stack Developer,"python, flutter, aws",Coursera,Swift Programming for iOS
Full Stack Developer,"node.js, mongodb, kubernetes, html, javascript",Udemy,Flutter App Development
Frontend Developer,"sql, react, deep learning",Pluralsight,Docker Essentials
Backend Developer,"css, flask, django, mongodb",edX,React Advanced Concepts
Full Stack Developer,"deep learning, machine learning, aws, flutter",Coursera,Flutter App Development
AI Engineer,"django, sql",edX,TensorFlow Deep Learning
Machine Learning Engineer,"aws, java, node.js, tensorflow, docker",Udemy,Kubernetes for Developers
Data Scientist,"flutter, sql, swift, react, django",Coursera,Flutter App Development
Frontend Developer,"machine learning, c++, django, html, sql",edX,TensorFlow Deep Learning
Machine Learning Engineer,"swift, kubernetes, pandas, html, flutter",edX,React Advanced Concepts
DevOps Engineer,"c++, django, kubernetes",Udemy,Docker Essentials
AI Engineer,"flask, c++, tensorflow, javascript",Coursera,HTML5 and CSS3 Fundamentals
AI Engineer,"kubernetes, javascript, pandas, machine learning, swift",Coursera,C++ Data Structures and Algorithms
Full Stack Developer,"css, node.js, tensorflow",Coursera,Node.js Backend Development
Frontend Developer,"flutter, c++, deep learning, kubernetes, django",edX,HTML5 and CSS3 Fundamentals
Data Scientist,"pandas, javascript, mongodb, django",Pluralsight,Node.js Backend Development
Backend Developer,"django, sql, swift, mongodb, kubernetes",LinkedIn Learning,HTML5 and CSS3 Fundamentals
Backend Developer,"docker, flutter",Pluralsight,Deep Learning Specialization
DevOps Engineer,"deep learning, pandas",LinkedIn Learning,SQL for Data Analysis
Data Scientist,"java, javascript, aws",Coursera,Kubernetes for Developers
Backend Developer,"mongodb, deep learning, html, sql, c++",Pluralsight,Data Analysis with Pandas
Frontend Developer,"mongodb, swift, node.js, pandas",LinkedIn Learning,Kubernetes for Developers
Mobile App Developer,"css, javascript, aws, mongodb",edX,Node.js Backend Development
Machine Learning Engineer,"flask, aws, deep learning",LinkedIn Learning,Python for Data Science
Mobile App Developer,"mongodb, aws",Pluralsight,HTML5 and CSS3 Fundamentals
DevOps Engineer,"pandas, machine learning",LinkedIn Learning,Flask for Web Applications
DevOps Engineer,"kubernetes, django, sql, machine learning, nlp",LinkedIn Learning,MongoDB for Beginners
Machine Learning Engineer,"c++, node.js",Coursera,Modern JavaScript Techniques
Backend Developer,"kubernetes, docker",Pluralsight,MongoDB for Beginners
Frontend Developer,"python, aws, flutter, deep learning",Udemy,Node.js Backend Development
DevOps Engineer,"python, tensorflow, nlp, django",edX,Kubernetes for Developers
Data Scientist,"flask, java, node.js, mongodb",LinkedIn Learning,Deep Learning Specialization
DevOps Engineer,"css, django",Pluralsight,Node.js Backend Development
Backend Developer,"nlp, kubernetes, java, deep learning",LinkedIn Learning,Django Web Development
DevOps Engineer,"react, java, tensorflow",Coursera,Deep Learning Specialization
Backend Developer,"docker, mongodb, node.js, c++, deep learning",LinkedIn Learning,Node.js Backend Development
Full Stack Developer,"node.js, swift",LinkedIn Learning,AWS Certified Solutions Architect
AI Engineer,"node.js, html",Udemy,Node.js Backend Development
Backend Developer,"flutter, swift, sql",Pluralsight,Flutter App Development
Backend Developer,"aws, django, docker, tensorflow",Coursera,AWS Certified Solutions Architect
Frontend Developer,"flask, c++, css",edX,C++ Data Structures and Algorithms
AI Engineer,"swift, java, django, kubernetes, sql",Pluralsight,React Advanced Concepts
AI Engineer,"sql, flutter, flask, tensorflow",Pluralsight,Flutter App Development
AI Engineer,"flask, django",edX,Java Programming Masterclass
Frontend Developer,"tensorflow, mongodb, c++, python, java",Coursera,Deep Learning Specialization
Frontend Developer,"flutter, c++, html, flask, pandas",Udemy,Java Programming Masterclass
DevOps Engineer,"python, nlp",LinkedIn Learning,Flask for Web Applications
DevOps Engineer,"nlp, sql, kubernetes, c++, deep learning",Udemy,React Advanced Concepts
Mobile App Developer,"mongodb, html, flask",Udemy,Flask for Web Applications
Backend Developer,"python, react",Udemy,Docker Essentials
Frontend Developer,"node.js, nlp, python, css",Pluralsight,Deep Learning Specialization
Machine Learning Engineer,"css, html",edX,Python for Data Science
Full Stack Developer,"kubernetes, flutter",Pluralsight,HTML5 and CSS3 Fundamentals
Backend Developer,"nlp, aws",LinkedIn Learning,Deep Learning Specialization
